Date,Time,CO(GT),NMHC(GT),C6H6(GT),NOx(GT),NO2(GT),T,RH,AH,precipitation (mm),cloud_cover (%),wind_speed_10m (km/h),terrestrial_radiation (W/m²),pressure_msl (hPa),soil_temperature_0_to_7cm (°C),I_CO,I_NMHC,I_C6H6,I_NOx,I_NO2,AQI,datetime
10/03/2004,18.00.00,2.6,150.0,11.9,312.08,113.0,13.6,48.9,0.7578,0.0,98,9.9,4.4,1020.8,7.6,26.0,125.5,157.20666666666668,113.43337423312883,58.23863636363636,157.20666666666668,2004-03-10 18:00:00
10/03/2004,19.00.00,2.0,112.0,9.4,193.64,92.0,13.3,47.7,0.7255,0.0,99,10.2,0.0,1020.9,7.2,20.0,106.88,144.12,101.56515337423313,46.0,144.12,2004-03-10 19:00:00
10/03/2004,20.00.00,2.2,88.0,9.0,246.27999999999997,114.0,11.9,54.0,0.7502,0.0,98,10.9,0.0,1020.9,6.9,22.0,88.24000000000001,140.2,106.83991820040899,58.79545454545455,140.2,2004-03-10 20:00:00
10/03/2004,21.00.00,2.2,80.0,9.2,323.35999999999996,122.0,11.0,60.0,0.7867,0.0,99,10.7,0.0,1020.8,6.8,22.0,80.4,142.16,114.56368098159508,63.25,142.16,2004-03-10 21:00:00
10/03/2004,22.00.00,1.6,51.0,6.5,246.27999999999997,116.0,11.2,59.6,0.7888,0.0,100,10.3,0.0,1020.4,6.7,16.0,51.98,115.7,106.83991820040899,59.90909090909091,115.7,2004-03-10 22:00:00
10/03/2004,23.00.00,1.2,38.0,4.7,167.32,96.0,11.2,59.2,0.7848,0.0,100,10.5,0.0,1019.7,6.7,12.0,38.0,95.1,88.48499999999999,48.0,95.1,2004-03-10 23:00:00
11/03/2004,00.00.00,1.2,31.0,3.6,116.55999999999999,77.0,11.3,56.8,0.7603,0.0,100,10.7,0.0,1019.7,6.7,12.0,31.0,77.13333333333333,60.22090909090908,38.5,77.13333333333333,2004-03-11 00:00:00
11/03/2004,01.00.00,1.0,31.0,3.3,116.55999999999999,76.0,10.7,60.0,0.7702,0.0,100,11.6,0.0,1019.2,6.7,10.0,31.0,72.23333333333332,60.22090909090908,38.0,72.23333333333332,2004-03-11 01:00:00
11/03/2004,02.00.00,0.9,24.0,2.3,84.6,60.0,10.7,59.7,0.7648,0.2,100,10.9,0.0,1018.6,6.7,9.0,24.0,55.9,42.3,30.0,55.9,2004-03-11 02:00:00
11/03/2004,03.00.00,0.6,19.0,1.7,0.0,0.0,10.3,60.2,0.7517,0.6,100,9.7,0.0,1017.9,6.6,6.0,19.0,42.5,0.0,0.0,42.5,2004-03-11 03:00:00
11/03/2004,04.00.00,0.0,14.0,1.3,39.48,34.0,10.1,60.5,0.7465,1.0,100,9.6,0.0,1017.1,6.5,0.0,14.0,32.5,19.74,17.0,32.5,2004-03-11 04:00:00
11/03/2004,05.00.00,0.7,8.0,1.1,30.08,28.0,11.0,56.2,0.7366,1.1,100,8.4,0.0,1016.1,6.4,7.0,8.0,27.500000000000004,15.04,14.0,27.500000000000004,2004-03-11 05:00:00
11/03/2004,06.00.00,0.7,16.0,1.6,63.919999999999995,48.0,10.5,58.1,0.7353,1.5,100,9.1,51.3,1015.7,6.3,7.0,16.0,40.0,31.959999999999997,24.0,40.0,2004-03-11 06:00:00
11/03/2004,07.00.00,1.1,29.0,3.2,184.23999999999998,82.0,10.2,59.6,0.7417,1.6,99,8.7,252.9,1015.4,6.5,11.0,29.0,70.6,97.90636363636362,41.0,97.90636363636362,2004-03-11 07:00:00
11/03/2004,08.00.00,2.0,64.0,8.0,327.12,112.0,10.8,57.4,0.7408,2.0,99,10.1,496.2,1014.8,6.8,20.0,64.72,130.4,114.94044989775051,57.68181818181818,130.4,2004-03-11 08:00:00
11/03/2004,09.00.00,2.2,87.0,9.5,242.51999999999998,101.0,10.5,60.6,0.7691,1.7,99,10.9,701.9,1014.0,6.9,22.0,87.25999999999999,145.1,106.46314928425357,51.55681818181818,145.1,2004-03-11 09:00:00
11/03/2004,10.00.00,1.7,77.0,6.3,210.56,98.0,10.8,58.4,0.7552,0.8,100,11.3,855.8,1013.1,7.3,17.0,77.46000000000001,113.74,103.26061349693252,49.0,113.74,2004-03-11 10:00:00
11/03/2004,11.00.00,1.5,43.0,5.0,178.6,92.0,10.5,57.9,0.7352,0.4,100,9.4,947.5,1012.4,7.5,15.0,43.0,100.0,94.76590909090908,46.0,100.0,2004-03-11 11:00:00
11/03/2004,12.00.00,1.6,61.0,5.2,195.51999999999998,95.0,9.5,66.8,0.7951,0.2,100,7.4,970.9,1011.9,7.7,16.0,61.78,102.96000000000001,101.75353783231084,47.5,102.96000000000001,2004-03-11 12:00:00
11/03/2004,13.00.00,1.9,63.0,7.3,274.47999999999996,112.0,8.3,76.4,0.8393,0.0,100,5.4,924.2,1011.7,8.5,19.0,63.74,123.53999999999999,109.66568507157464,57.68181818181818,123.53999999999999,2004-03-11 13:00:00
11/03/2004,14.00.00,2.9,164.0,11.5,389.15999999999997,128.0,8.0,81.1,0.8736,0.2,100,4.0,810.7,1011.8,8.8,29.0,132.36,155.9,121.15713701431493,66.5909090909091,155.9,2004-03-11 14:00:00
11/03/2004,15.00.00,2.2,79.0,8.8,345.91999999999996,126.0,8.3,79.8,0.8778,0.1,100,4.5,638.2,1011.9,9.0,22.0,79.42,138.24,116.8242944785276,65.47727272727272,138.24,2004-03-11 15:00:00
11/03/2004,16.00.00,2.2,95.0,8.3,362.84,131.0,9.7,71.2,0.8569,0.1,95,4.6,418.5,1012.3,8.8,22.0,95.1,133.34,118.51975460122699,68.26136363636363,133.34,2004-03-11 16:00:00
11/03/2004,17.00.00,2.9,150.0,11.2,456.84,135.0,9.8,67.6,0.8185,0.0,85,5.1,166.5,1012.8,8.4,29.0,125.5,154.92,127.93897750511248,70.48863636363636,154.92,2004-03-11 17:00:00
11/03/2004,18.00.00,4.8,307.0,20.8,528.28,151.0,10.3,64.2,0.8065,0.0,72,6.2,6.9,1013.5,8.0,48.0,177.215,186.28,135.09758691206542,79.39772727272727,186.28,2004-03-11 18:00:00
11/03/2004,19.00.00,6.9,461.0,27.4,720.04,172.0,9.7,69.3,0.8319,0.0,59,6.1,0.0,1014.3,7.8,69.62,216.0975,224.76,154.87676470588235,91.0909090909091,224.76,2004-03-11 19:00:00
11/03/2004,20.00.00,6.1,401.0,24.0,659.88,165.0,9.6,67.8,0.8133,0.0,44,7.3,0.0,1015.4,7.3,61.78,201.2475,196.73333333333335,148.2844989775051,87.19318181818181,201.2475,2004-03-11 20:00:00
11/03/2004,21.00.00,3.9,197.0,12.8,451.2,136.0,9.1,64.0,0.7419,0.0,25,8.6,0.0,1016.0,6.9,39.0,148.53,160.14666666666668,127.37382413087934,71.04545454545455,160.14666666666668,2004-03-11 21:00:00
11/03/2004,22.00.00,1.5,61.0,4.7,176.72,85.0,8.2,63.4,0.6905,0.0,43,9.8,0.0,1016.9,6.5,15.0,61.78,95.1,93.71909090909091,42.5,95.1,2004-03-11 22:00:00
11/03/2004,23.00.00,1.0,26.0,2.6,88.36,53.0,8.2,60.8,0.6657,0.0,59,9.4,0.0,1017.7,6.1,10.0,26.0,60.8,44.18,26.5,60.8,2004-03-11 23:00:00
12/03/2004,00.00.00,1.7,55.0,5.9,229.35999999999999,97.0,8.3,58.5,0.6438,0.0,68,8.7,0.0,1018.1,5.9,17.0,55.9,109.82000000000001,105.14445807770961,48.5,109.82000000000001,2004-03-12 00:00:00
12/03/2004,01.00.00,1.9,53.0,6.4,250.04,110.0,7.7,59.7,0.6308,0.0,66,8.2,0.0,1018.8,5.7,19.0,53.94,114.72,107.21668711656442,56.56818181818182,114.72,2004-03-12 01:00:00
12/03/2004,02.00.00,1.4,40.0,4.1,154.16,91.0,7.1,61.8,0.6276,0.0,63,8.2,0.0,1019.2,5.5,14.0,40.0,85.29999999999998,81.15727272727273,45.5,85.29999999999998,2004-03-12 02:00:00
12/03/2004,03.00.00,0.8,21.0,1.9,0.0,0.0,7.0,62.3,0.6261,0.0,79,7.2,0.0,1019.3,5.2,8.0,21.0,47.5,0.0,0.0,47.5,2004-03-12 03:00:00
12/03/2004,04.00.00,0.0,10.0,1.1,39.48,32.0,6.1,65.9,0.6248,0.0,72,7.3,0.0,1019.9,4.9,0.0,10.0,27.500000000000004,19.74,16.0,27.500000000000004,2004-03-12 04:00:00
12/03/2004,05.00.00,0.6,7.0,1.0,56.4,44.0,6.3,65.0,0.6233,0.0,63,8.1,0.0,1020.0,4.7,6.0,7.0,25.0,28.2,22.0,28.2,2004-03-12 05:00:00
12/03/2004,06.00.00,0.8,17.0,1.8,105.28,71.0,6.8,62.9,0.6234,0.0,54,8.2,55.2,1020.6,4.7,8.0,17.0,45.0,53.94,35.5,53.94,2004-03-12 06:00:00
12/03/2004,07.00.00,1.4,33.0,4.4,204.92,104.0,6.4,65.1,0.6316,0.0,47,9.3,260.4,1021.2,5.7,14.0,33.0,90.2,102.69546012269939,53.22727272727273,102.69546012269939,2004-03-12 07:00:00
12/03/2004,08.00.00,4.4,202.0,17.9,577.16,141.0,7.3,63.1,0.6499,0.0,37,10.8,503.6,1021.6,7.0,44.0,151.49,176.80666666666667,139.99558282208588,73.82954545454545,176.80666666666667,2004-03-12 08:00:00
12/03/2004,09.00.00,0.0,0.0,22.1,0.0,0.0,9.2,56.2,0.6561,0.0,45,10.1,709.0,1022.1,8.4,0.0,0.0,190.52666666666667,0.0,0.0,190.52666666666667,2004-03-12 09:00:00
12/03/2004,10.00.00,3.1,208.0,14.0,351.56,122.0,13.2,41.7,0.632,0.0,46,7.3,862.6,1022.1,10.1,31.0,152.96,164.06666666666666,117.38944785276074,63.25,164.06666666666666,2004-03-12 10:00:00
12/03/2004,11.00.00,2.7,166.0,11.6,406.08,143.0,14.3,38.4,0.6243,0.0,89,2.5,954.1,1022.2,11.8,27.0,133.34,156.22666666666666,122.85259713701431,74.94318181818181,156.22666666666666,2004-03-12 11:00:00
12/03/2004,12.00.00,2.1,114.0,10.2,268.84,113.0,15.0,36.5,0.6195,0.0,69,2.6,977.1,1021.8,13.2,21.0,107.86,151.65333333333334,109.10053169734151,58.23863636363636,151.65333333333334,2004-03-12 12:00:00
12/03/2004,13.00.00,2.5,140.0,11.0,300.79999999999995,116.0,16.1,34.5,0.6262,0.0,21,6.6,930.1,1021.7,13.9,25.0,120.6,154.26666666666668,112.30306748466258,59.90909090909091,154.26666666666668,2004-03-12 13:00:00
12/03/2004,14.00.00,2.7,169.0,12.8,306.44,123.0,16.3,35.7,0.656,0.0,28,10.3,816.4,1022.1,13.8,27.0,134.81,160.14666666666668,112.86822085889571,63.80681818181818,160.14666666666668,2004-03-12 14:00:00
12/03/2004,15.00.00,2.9,185.0,14.2,357.2,126.0,15.8,37.0,0.661,0.0,21,11.4,643.6,1022.8,13.2,29.0,142.65,164.72,117.95460122699386,65.47727272727272,164.72,2004-03-12 15:00:00
12/03/2004,16.00.00,2.8,165.0,12.7,334.64,120.0,15.9,37.2,0.6657,0.0,6,9.4,423.7,1023.1,12.2,28.0,132.85,159.82,115.69398773006135,62.13636363636363,159.82,2004-03-12 16:00:00
12/03/2004,17.00.00,2.4,133.0,11.7,282.0,119.0,16.9,34.3,0.6549,0.0,3,4.9,171.6,1023.3,10.8,24.0,117.17,156.55333333333334,110.41922290388548,61.57954545454545,156.55333333333334,2004-03-12 17:00:00
12/03/2004,18.00.00,3.9,233.0,19.3,387.28,149.0,15.1,39.6,0.6766,0.0,1,7.6,9.5,1023.6,9.5,39.0,159.085,181.38,120.96875255623722,78.2840909090909,181.38,2004-03-12 18:00:00
12/03/2004,19.00.00,3.7,242.0,18.2,379.76,145.0,14.4,43.4,0.7084,0.0,2,6.5,0.0,1024.0,8.3,37.0,161.29,177.78666666666666,120.21521472392638,76.05681818181819,177.78666666666666,2004-03-12 19:00:00
12/03/2004,20.00.00,6.6,488.0,32.6,639.1999999999999,170.0,12.9,50.5,0.7478,0.0,23,5.2,0.0,1024.5,7.2,66.67999999999999,222.78,276.24,146.2122699386503,89.97727272727272,276.24,2004-03-12 20:00:00
12/03/2004,21.00.00,4.4,333.0,20.1,515.12,149.0,12.1,53.3,0.7536,0.0,92,4.8,0.0,1024.8,6.4,44.0,183.585,183.99333333333334,133.77889570552148,78.2840909090909,183.99333333333334,2004-03-12 21:00:00
12/03/2004,22.00.00,3.5,215.0,14.3,475.64,139.0,11.0,59.1,0.774,0.0,95,5.4,0.0,1025.3,5.8,35.0,154.675,165.04666666666668,129.82282208588956,72.7159090909091,165.04666666666668,2004-03-12 22:00:00
12/03/2004,23.00.00,5.4,367.0,21.8,564.0,134.0,9.7,64.6,0.7771,0.0,83,5.8,0.0,1025.4,5.4,54.92,191.915,189.54666666666668,138.67689161554193,69.93181818181819,191.915,2004-03-12 23:00:00
13/03/2004,00.00.00,2.7,122.0,9.6,362.84,113.0,9.5,64.1,0.7597,0.0,90,5.8,0.0,1025.4,5.0,27.0,111.78,146.07999999999998,118.51975460122699,58.23863636363636,146.07999999999998,2004-03-13 00:00:00
13/03/2004,01.00.00,1.9,67.0,7.4,261.32,97.0,9.1,63.9,0.7423,0.0,92,5.4,0.0,1025.5,4.7,19.0,67.66,124.52000000000001,108.34699386503067,48.5,124.52000000000001,2004-03-13 01:00:00
13/03/2004,02.00.00,1.6,43.0,5.4,156.04,82.0,8.8,63.9,0.7256,0.0,94,6.2,0.0,1025.3,4.4,16.0,43.0,104.92,82.2040909090909,41.0,104.92,2004-03-13 02:00:00
13/03/2004,03.00.00,1.7,46.0,5.4,0.0,0.0,7.8,67.5,0.7173,0.0,96,6.2,0.0,1025.4,4.3,17.0,46.0,104.92,0.0,0.0,104.92,2004-03-13 03:00:00
13/03/2004,04.00.00,0.0,56.0,6.2,204.92,83.0,7.0,71.1,0.7158,0.0,88,5.8,0.0,1025.5,4.2,0.0,56.88,112.76,102.69546012269939,41.5,112.76,2004-03-13 04:00:00
13/03/2004,05.00.00,1.0,30.0,2.6,116.55999999999999,65.0,8.3,63.6,0.6982,0.0,89,5.8,0.0,1026.0,4.1,10.0,30.0,60.8,60.22090909090908,32.5,60.8,2004-03-13 05:00:00
13/03/2004,06.00.00,1.2,27.0,2.9,99.64,60.0,7.2,67.5,0.6887,0.0,91,5.1,59.0,1026.2,4.1,12.0,27.0,65.7,49.82,30.0,65.7,2004-03-13 06:00:00
13/03/2004,07.00.00,1.5,47.0,5.1,261.32,77.0,6.3,71.9,0.6932,0.0,95,6.5,267.9,1026.7,5.7,15.0,47.0,101.97999999999999,108.34699386503067,38.5,108.34699386503067,2004-03-13 07:00:00
13/03/2004,08.00.00,2.7,132.0,11.8,481.28,96.0,6.5,71.6,0.6945,0.0,98,4.9,510.9,1027.2,8.3,27.0,116.68,156.88,130.3879754601227,48.0,156.88,2004-03-13 08:00:00
13/03/2004,09.00.00,3.7,239.0,15.1,554.6,119.0,9.6,59.7,0.7124,0.0,100,9.1,716.1,1027.2,10.1,37.0,160.555,167.66,137.73496932515337,61.57954545454545,167.66,2004-03-13 09:00:00
13/03/2004,10.00.00,3.2,160.0,12.9,470.0,126.0,12.4,51.2,0.7335,0.0,88,11.4,869.4,1027.5,11.6,32.0,130.4,160.47333333333333,129.25766871165644,65.47727272727272,160.47333333333333,2004-03-13 10:00:00
13/03/2004,11.00.00,4.1,283.0,16.1,556.48,158.0,15.6,42.2,0.7451,0.0,90,13.1,960.5,1027.0,12.7,41.0,171.335,170.92666666666668,137.92335378323108,83.29545454545453,171.335,2004-03-13 11:00:00
13/03/2004,12.00.00,3.6,210.0,14.0,449.32,161.0,18.4,33.8,0.709,0.0,79,13.4,983.2,1026.6,13.5,36.0,153.45,164.06666666666666,127.18543967280164,84.9659090909091,164.06666666666666,2004-03-13 12:00:00
13/03/2004,13.00.00,2.8,154.0,12.3,287.64,124.0,19.4,31.3,0.695,0.0,72,13.5,935.9,1025.8,14.0,28.0,127.46000000000001,158.51333333333332,110.9843762781186,64.36363636363636,158.51333333333332,2004-03-13 13:00:00
13/03/2004,14.00.00,2.0,112.0,8.6,221.83999999999997,102.0,18.0,34.8,0.7127,0.0,86,13.3,821.9,1026.0,13.9,20.0,106.88,136.28,104.39092024539877,52.11363636363637,136.28,2004-03-13 14:00:00
13/03/2004,15.00.00,2.0,108.0,9.2,223.72,116.0,18.4,33.6,0.7042,0.0,77,13.0,649.0,1026.1,13.3,20.0,104.92,142.16,104.57930470347648,59.90909090909091,142.16,2004-03-13 15:00:00
13/03/2004,16.00.00,2.5,111.0,10.2,259.44,124.0,17.6,35.1,0.7012,0.0,73,9.9,428.9,1026.5,12.6,25.0,106.39,151.65333333333334,108.15860940695296,64.36363636363636,151.65333333333334,2004-03-13 16:00:00
13/03/2004,17.00.00,2.3,97.0,10.6,278.24,125.0,16.7,37.8,0.7117,0.0,85,8.3,176.8,1026.9,11.6,23.0,97.06,152.96,110.04245398773006,64.92045454545455,152.96,2004-03-13 17:00:00
13/03/2004,18.00.00,3.2,191.0,15.5,426.76,148.0,16.1,41.0,0.7451,0.0,99,9.7,12.1,1027.0,10.8,32.0,145.59,168.96666666666667,124.92482617586911,77.72727272727272,168.96666666666667,2004-03-13 18:00:00
13/03/2004,19.00.00,4.2,258.0,19.6,520.76,165.0,15.8,42.4,0.7569,0.0,98,8.9,0.0,1027.3,10.0,42.0,165.21,182.36,134.3440490797546,87.19318181818181,182.36,2004-03-13 19:00:00
13/03/2004,20.00.00,4.2,284.0,19.2,524.52,161.0,15.7,44.1,0.7786,0.0,100,6.3,0.0,1027.5,9.4,42.0,171.57999999999998,181.05333333333334,134.72081799591,84.9659090909091,181.05333333333334,2004-03-13 20:00:00
13/03/2004,21.00.00,4.2,269.0,18.3,532.04,159.0,15.3,46.8,0.8091,0.0,98,4.3,0.0,1028.0,8.7,42.0,167.905,178.11333333333334,135.47435582822084,83.85227272727272,178.11333333333334,2004-03-13 21:00:00
13/03/2004,22.00.00,3.1,180.0,13.1,402.32,143.0,14.6,48.6,0.806,0.0,99,4.0,0.0,1028.8,8.1,31.0,140.2,161.12666666666667,122.47582822085889,74.94318181818181,161.12666666666667,2004-03-13 22:00:00
13/03/2004,23.00.00,2.6,116.0,10.9,323.35999999999996,130.0,14.7,49.3,0.8193,0.0,100,4.3,0.0,1029.1,7.7,26.0,108.84,153.94,114.56368098159508,67.70454545454545,153.94,2004-03-13 23:00:00
14/03/2004,00.00.00,2.9,93.0,11.0,357.2,129.0,13.9,53.6,0.8498,0.0,99,5.0,0.0,1028.9,7.4,29.0,93.14,154.26666666666668,117.95460122699386,67.14772727272727,154.26666666666668,2004-03-14 00:00:00
14/03/2004,01.00.00,2.8,131.0,11.9,327.12,119.0,14.6,51.5,0.8536,0.0,99,4.6,0.0,1028.9,7.1,28.0,116.19,157.20666666666668,114.94044989775051,61.57954545454545,157.20666666666668,2004-03-14 01:00:00
14/03/2004,02.00.00,2.5,92.0,8.6,240.64,104.0,12.5,58.9,0.8537,0.0,98,4.0,0.0,1028.5,6.8,25.0,92.16,136.28,106.27476482617587,53.22727272727273,136.28,2004-03-14 02:00:00
14/03/2004,03.00.00,2.4,132.0,9.7,0.0,0.0,11.6,63.4,0.8674,0.0,91,4.0,0.0,1028.7,6.5,24.0,116.68,147.06,0.0,0.0,147.06,2004-03-14 03:00:00
14/03/2004,04.00.00,0.0,56.0,5.2,131.6,82.0,12.1,61.1,0.8603,0.0,95,4.0,0.0,1029.0,6.1,0.0,56.88,102.96000000000001,68.59545454545454,41.0,102.96000000000001,2004-03-14 04:00:00
14/03/2004,05.00.00,1.2,32.0,3.7,99.64,70.0,11.5,63.1,0.8533,0.0,98,4.1,0.0,1029.5,5.8,12.0,32.0,78.76666666666667,49.82,35.0,78.76666666666667,2004-03-14 05:00:00
14/03/2004,06.00.00,1.0,29.0,2.5,82.72,63.0,11.6,62.2,0.8473,0.0,94,4.2,62.8,1029.8,5.7,10.0,29.0,59.166666666666664,41.36,31.5,59.166666666666664,2004-03-14 06:00:00
14/03/2004,07.00.00,0.9,27.0,2.4,139.12,67.0,10.4,67.6,0.853,0.0,93,4.9,275.4,1030.1,7.2,9.0,27.0,57.53333333333333,72.78272727272727,33.5,72.78272727272727,2004-03-14 07:00:00
14/03/2004,08.00.00,1.4,36.0,4.2,189.88,84.0,11.6,62.7,0.853,0.0,99,2.9,518.2,1030.6,10.5,14.0,36.0,86.93333333333334,101.1883844580777,42.0,101.1883844580777,2004-03-14 08:00:00
14/03/2004,09.00.00,1.6,57.0,6.4,221.83999999999997,83.0,12.4,60.0,0.8627,0.0,99,5.2,723.1,1031.1,12.4,16.0,57.86,114.72,104.39092024539877,41.5,114.72,2004-03-14 09:00:00
14/03/2004,10.00.00,2.2,129.0,8.6,270.71999999999997,98.0,14.5,53.1,0.8728,0.0,99,4.1,876.2,1031.0,13.9,22.0,115.21,136.28,109.28891615541922,49.0,136.28,2004-03-14 10:00:00
14/03/2004,11.00.00,2.8,148.0,10.9,330.88,114.0,16.9,46.1,0.8789,0.0,99,5.7,966.9,1031.3,15.0,28.0,124.52,153.94,115.31721881390592,58.79545454545455,153.94,2004-03-14 11:00:00
14/03/2004,12.00.00,2.8,145.0,10.7,302.68,119.0,19.3,38.3,0.8474,0.0,100,6.6,989.3,1031.1,15.5,28.0,123.05,153.28666666666666,112.49145194274028,61.57954545454545,153.28666666666666,2004-03-14 12:00:00
14/03/2004,13.00.00,2.0,93.0,7.5,212.44,104.0,21.2,31.4,0.7812,0.0,99,7.6,941.7,1031.0,15.9,20.0,93.14,125.5,103.44899795501023,53.22727272727273,125.5,2004-03-14 13:00:00
14/03/2004,14.00.00,1.8,84.0,7.5,193.64,102.0,21.4,30.2,0.7616,0.0,100,6.9,827.4,1030.6,15.8,18.0,84.32,125.5,101.56515337423313,52.11363636363637,125.5,2004-03-14 14:00:00
14/03/2004,15.00.00,1.9,99.0,8.2,210.56,107.0,21.9,29.0,0.7525,0.0,100,6.9,654.3,1030.4,15.3,19.0,99.02,132.35999999999999,103.26061349693252,54.89772727272727,132.35999999999999,2004-03-14 15:00:00
14/03/2004,16.00.00,3.0,150.0,11.9,319.59999999999997,129.0,22.2,28.4,0.7516,0.0,100,6.3,434.1,1030.4,14.4,30.0,125.5,157.20666666666668,114.18691206543967,67.14772727272727,157.20666666666668,2004-03-14 16:00:00
14/03/2004,17.00.00,2.9,156.0,12.0,338.4,128.0,21.3,30.8,0.7696,0.0,99,6.2,181.9,1030.6,13.1,29.0,128.44,157.53333333333333,116.07075664621676,66.5909090909091,157.53333333333333,2004-03-14 17:00:00
14/03/2004,18.00.00,2.5,122.0,12.2,300.79999999999995,121.0,19.7,36.7,0.8307,0.0,100,6.1,14.7,1031.1,11.9,25.0,111.78,158.18666666666667,112.30306748466258,62.69318181818181,158.18666666666667,2004-03-14 18:00:00
14/03/2004,19.00.00,4.6,262.0,20.6,490.67999999999995,157.0,18.4,41.7,0.8732,0.0,100,4.1,0.0,1031.6,10.6,46.0,166.19,185.62666666666667,131.32989775051124,82.73863636363636,185.62666666666667,2004-03-14 19:00:00
14/03/2004,20.00.00,5.9,341.0,23.1,611.0,173.0,17.6,46.1,0.921,0.0,100,2.9,0.0,1031.7,9.7,59.82000000000001,185.54500000000002,193.79333333333335,143.38650306748465,91.64772727272727,193.79333333333335,2004-03-14 20:00:00
14/03/2004,21.00.00,3.4,214.0,14.7,407.96,146.0,16.7,49.6,0.932,0.0,100,2.6,0.0,1032.0,9.1,34.0,154.43,166.35333333333332,123.04098159509202,76.61363636363636,166.35333333333332,2004-03-14 21:00:00
14/03/2004,22.00.00,2.1,100.0,9.0,274.47999999999996,121.0,16.3,51.0,0.9341,0.0,100,2.3,0.0,1032.5,8.6,21.0,100.0,140.2,109.66568507157464,62.69318181818181,140.2,2004-03-14 22:00:00
14/03/2004,23.00.00,2.2,79.0,8.8,285.76,119.0,14.7,55.9,0.9314,0.0,100,2.9,0.0,1032.7,8.3,22.0,79.42,138.24,110.7959918200409,61.57954545454545,138.24,2004-03-14 23:00:00
15/03/2004,00.00.00,1.8,66.0,7.4,195.51999999999998,99.0,14.8,54.7,0.9164,0.0,100,3.1,0.0,1032.2,8.4,18.0,66.68,124.52000000000001,101.75353783231084,49.5,124.52000000000001,2004-03-15 00:00:00
15/03/2004,01.00.00,1.8,73.0,6.9,199.28,93.0,14.0,57.0,0.9094,0.0,100,3.6,0.0,1032.4,8.6,18.0,73.53999999999999,119.62,102.13030674846625,46.5,119.62,2004-03-15 01:00:00
15/03/2004,02.00.00,1.8,66.0,7.0,203.04,88.0,13.4,61.3,0.9361,0.0,100,2.5,0.0,1031.6,8.6,18.0,66.68,120.6,102.50707566462168,44.0,120.6,2004-03-15 02:00:00
15/03/2004,03.00.00,1.1,44.0,4.4,0.0,0.0,12.6,63.5,0.923,0.0,100,2.8,0.0,1031.6,8.4,11.0,44.0,90.2,0.0,0.0,90.2,2004-03-15 03:00:00
15/03/2004,04.00.00,0.0,44.0,4.0,124.08,71.0,12.3,65.4,0.9351,0.0,99,2.5,0.0,1031.4,8.1,0.0,44.0,83.66666666666666,64.40818181818182,35.5,83.66666666666666,2004-03-15 04:00:00
15/03/2004,05.00.00,1.0,39.0,3.9,165.44,74.0,11.9,67.4,0.9375,0.0,99,2.3,0.0,1031.7,7.6,10.0,39.0,82.03333333333333,87.43818181818182,37.0,87.43818181818182,2004-03-15 05:00:00
15/03/2004,06.00.00,1.4,51.0,6.4,259.44,80.0,11.4,70.5,0.9475,0.0,99,2.3,66.5,1032.1,7.4,14.0,51.98,114.72,108.15860940695296,40.0,114.72,2004-03-15 06:00:00
15/03/2004,07.00.00,2.2,107.0,9.7,428.64,89.0,11.3,70.2,0.9401,0.0,97,3.4,282.8,1032.3,8.7,22.0,104.43,147.06,125.11321063394684,44.5,147.06,2004-03-15 07:00:00
15/03/2004,08.00.00,5.5,336.0,25.9,676.8,114.0,12.4,63.9,0.917,0.0,95,1.5,525.4,1032.7,11.6,55.9,184.32,209.91,149.9799591002045,58.79545454545455,209.91,2004-03-15 08:00:00
15/03/2004,09.00.00,8.1,618.0,36.7,898.64,149.0,14.8,54.3,0.9076,0.0,90,1.0,730.1,1032.7,13.8,81.38,254.95499999999998,316.83000000000004,170.96389705882353,78.2840909090909,316.83000000000004,2004-03-15 09:00:00
15/03/2004,10.00.00,5.8,438.0,26.6,740.7199999999999,157.0,17.4,45.6,0.8993,0.0,89,2.8,882.8,1032.7,15.5,58.839999999999996,210.405,216.84,156.73948529411763,82.73863636363636,216.84,2004-03-15 10:00:00
15/03/2004,11.00.00,4.2,334.0,20.1,599.7199999999999,155.0,19.8,38.5,0.8801,0.0,69,3.8,973.3,1032.5,16.7,42.0,183.82999999999998,183.99333333333334,142.2561963190184,81.625,183.99333333333334,2004-03-15 11:00:00
15/03/2004,12.00.00,3.1,221.0,14.1,377.88,134.0,22.0,34.1,0.8904,0.0,31,4.7,995.3,1032.1,17.4,31.0,156.145,164.39333333333335,120.02683026584867,69.93181818181819,164.39333333333335,2004-03-15 12:00:00
15/03/2004,13.00.00,2.9,207.0,14.9,321.47999999999996,119.0,23.3,32.2,0.9096,0.0,34,5.1,947.4,1031.7,17.7,29.0,152.715,167.00666666666666,114.37529652351738,61.57954545454545,167.00666666666666,2004-03-15 13:00:00
15/03/2004,14.00.00,2.9,191.0,15.4,298.91999999999996,111.0,23.9,30.0,0.8757,0.0,0,6.2,832.9,1031.2,17.6,29.0,145.59,168.64,112.11468302658486,57.125,168.64,2004-03-15 14:00:00
15/03/2004,15.00.00,2.5,185.0,12.1,287.64,104.0,24.4,28.9,0.8736,0.0,0,9.1,659.5,1031.1,17.0,25.0,142.65,157.85999999999999,110.9843762781186,53.22727272727273,157.85999999999999,2004-03-15 15:00:00
15/03/2004,16.00.00,2.3,141.0,11.5,268.84,99.0,24.4,29.4,0.8848,0.0,0,10.0,439.2,1031.0,16.1,23.0,121.09,155.9,109.10053169734151,49.5,155.9,2004-03-15 16:00:00
15/03/2004,17.00.00,2.8,214.0,14.8,293.28,110.0,23.8,31.3,0.9137,0.0,0,6.0,187.0,1031.5,14.7,28.0,154.43,166.68,111.54952965235174,56.56818181818182,166.68,2004-03-15 17:00:00
15/03/2004,18.00.00,6.1,471.0,32.1,590.3199999999999,162.0,22.5,35.4,0.9547,0.0,0,4.8,17.2,1031.9,13.3,61.78,218.5725,271.29,141.31427402862985,85.52272727272727,271.29,2004-03-15 18:00:00
15/03/2004,19.00.00,8.0,685.0,39.2,759.52,187.0,20.4,42.5,1.0086,0.0,1,3.4,0.0,1032.5,11.9,80.4,271.5375,341.58000000000004,158.43286764705883,99.44318181818181,341.58000000000004,2004-03-15 19:00:00
15/03/2004,20.00.00,6.5,538.0,31.0,601.5999999999999,165.0,18.3,52.6,1.0945,0.0,72,1.1,0.0,1032.9,10.7,65.7,235.155,260.4,142.44458077709612,87.19318181818181,260.4,2004-03-15 20:00:00
15/03/2004,21.00.00,4.2,319.0,19.9,481.28,145.0,16.7,57.4,1.0786,0.0,73,1.8,0.0,1033.2,9.9,42.0,180.155,183.34,130.3879754601227,76.05681818181819,183.34,2004-03-15 21:00:00
15/03/2004,22.00.00,3.2,224.0,15.3,362.84,125.0,15.7,60.2,1.0654,0.0,77,2.8,0.0,1033.2,9.4,32.0,156.88,168.31333333333333,118.51975460122699,64.92045454545455,168.31333333333333,2004-03-15 22:00:00
15/03/2004,23.00.00,1.4,67.0,6.9,167.32,101.0,15.3,61.4,1.058,0.0,77,3.6,0.0,1033.5,9.0,14.0,67.66,119.62,88.48499999999999,51.55681818181818,119.62,2004-03-15 23:00:00
16/03/2004,00.00.00,2.1,155.0,11.1,238.76,103.0,14.1,65.7,1.0494,0.0,85,3.3,0.0,1033.2,9.0,21.0,127.95,154.59333333333333,106.08638036809816,52.67045454545455,154.59333333333333,2004-03-16 00:00:00
16/03/2004,01.00.00,1.2,49.0,5.4,148.51999999999998,88.0,14.8,60.6,1.0148,0.0,100,4.3,0.0,1033.2,9.1,12.0,49.0,104.92,78.01681818181817,44.0,104.92,2004-03-16 01:00:00
16/03/2004,02.00.00,0.8,29.0,2.8,80.83999999999999,61.0,14.8,59.2,0.9879,0.0,100,5.1,0.0,1032.7,9.1,8.0,29.0,64.06666666666666,40.419999999999995,30.5,64.06666666666666,2004-03-16 02:00:00
16/03/2004,03.00.00,0.7,25.0,2.3,0.0,0.0,13.6,62.1,0.9636,0.0,100,4.9,0.0,1032.5,9.2,7.0,25.0,55.9,0.0,0.0,55.9,2004-03-16 03:00:00
16/03/2004,04.00.00,0.0,25.0,2.6,110.91999999999999,59.0,12.3,66.2,0.945,0.0,100,5.2,0.0,1032.3,9.2,0.0,25.0,60.8,57.080454545454536,29.5,60.8,2004-03-16 04:00:00
16/03/2004,05.00.00,0.6,17.0,2.0,71.44,52.0,12.8,63.2,0.9283,0.0,100,5.5,0.0,1032.3,9.1,6.0,17.0,50.0,35.72,26.0,50.0,2004-03-16 05:00:00
16/03/2004,06.00.00,0.9,27.0,3.5,154.16,64.0,11.2,68.5,0.9081,0.0,100,5.5,70.3,1032.7,9.1,9.0,27.0,75.5,81.15727272727273,32.0,81.15727272727273,2004-03-16 06:00:00
16/03/2004,07.00.00,1.3,50.0,5.1,186.11999999999998,70.0,11.0,66.5,0.8705,0.0,100,4.7,290.2,1033.4,9.8,13.0,50.0,101.97999999999999,98.9531818181818,35.0,101.97999999999999,2004-03-16 07:00:00
16/03/2004,08.00.00,3.4,218.0,16.2,494.44,97.0,11.7,63.7,0.8719,0.0,88,3.4,532.6,1033.8,11.5,34.0,155.41,171.25333333333333,131.70666666666665,48.5,171.25333333333333,2004-03-16 08:00:00
16/03/2004,09.00.00,3.7,285.0,19.7,430.52,95.0,13.6,56.3,0.8743,0.0,18,1.1,737.0,1033.7,13.3,37.0,171.825,182.68666666666667,125.30159509202454,47.5,182.68666666666667,2004-03-16 09:00:00
16/03/2004,10.00.00,5.3,437.0,25.1,744.4799999999999,150.0,17.8,42.9,0.8672,0.0,4,0.4,889.4,1033.5,15.4,53.94,210.1575,201.99,157.07816176470587,78.8409090909091,210.1575,2004-03-16 10:00:00
16/03/2004,11.00.00,4.1,327.0,20.0,590.3199999999999,162.0,21.4,33.3,0.8417,0.0,1,2.2,979.5,1033.1,16.8,41.0,182.115,183.66666666666666,141.31427402862985,85.52272727272727,183.66666666666666,2004-03-16 11:00:00
16/03/2004,12.00.00,3.3,283.0,18.3,407.96,154.0,24.4,27.4,0.8231,0.0,0,3.3,1001.2,1032.5,17.3,33.0,171.335,178.11333333333334,123.04098159509202,81.06818181818181,178.11333333333334,2004-03-16 12:00:00
16/03/2004,13.00.00,4.0,366.0,22.3,473.76,161.0,25.3,26.1,0.8264,0.0,0,4.7,953.0,1031.7,17.9,40.0,191.67000000000002,191.18,129.63443762781185,84.9659090909091,191.67000000000002,2004-03-16 13:00:00
16/03/2004,14.00.00,3.8,318.0,20.4,494.44,161.0,25.8,23.2,0.7589,0.0,0,6.2,838.2,1031.4,18.1,38.0,179.91,184.97333333333333,131.70666666666665,84.9659090909091,184.97333333333333,2004-03-16 14:00:00
16/03/2004,15.00.00,2.8,228.0,14.6,338.4,128.0,27.0,20.2,0.7094,0.0,0,6.6,664.7,1031.1,17.6,28.0,157.86,166.02666666666667,116.07075664621676,66.5909090909091,166.02666666666667,2004-03-16 15:00:00
16/03/2004,16.00.00,2.9,201.0,16.6,345.91999999999996,129.0,28.2,18.6,0.7014,0.0,0,7.3,444.3,1030.9,16.7,29.0,151.245,172.56,116.8242944785276,67.14772727272727,172.56,2004-03-16 16:00:00
16/03/2004,17.00.00,2.9,199.0,15.8,357.2,133.0,28.0,19.1,0.7098,0.0,4,5.8,192.0,1031.0,15.3,29.0,149.51,169.94666666666666,117.95460122699386,69.375,169.94666666666666,2004-03-16 17:00:00
16/03/2004,18.00.00,3.4,237.0,17.8,345.91999999999996,139.0,23.9,25.7,0.7519,0.0,4,5.6,19.8,1031.3,13.8,34.0,160.065,176.48,116.8242944785276,72.7159090909091,176.48,2004-03-16 18:00:00
16/03/2004,19.00.00,3.9,261.0,19.1,340.28,137.0,21.3,34.8,0.873,0.0,4,4.4,0.0,1031.8,12.9,39.0,165.945,180.72666666666666,116.25914110429447,71.60227272727272,180.72666666666666,2004-03-16 19:00:00
16/03/2004,20.00.00,3.2,230.0,15.8,312.08,143.0,20.4,36.7,0.8704,0.0,5,3.4,0.0,1032.4,12.1,32.0,158.35,169.94666666666666,113.43337423312883,74.94318181818181,169.94666666666666,2004-03-16 20:00:00
16/03/2004,21.00.00,5.1,349.0,24.9,595.9599999999999,177.0,19.0,41.3,0.9007,0.0,9,3.5,0.0,1032.1,11.4,51.98,187.505,199.67333333333332,141.87942740286297,93.875,199.67333333333332,2004-03-16 21:00:00
16/03/2004,22.00.00,2.6,183.0,13.5,345.91999999999996,138.0,17.9,45.9,0.9342,0.0,12,1.5,0.0,1032.0,11.0,26.0,141.67000000000002,162.43333333333334,116.8242944785276,72.1590909090909,162.43333333333334,2004-03-16 22:00:00
16/03/2004,23.00.00,1.7,88.0,9.1,244.39999999999998,117.0,16.7,48.9,0.9226,0.0,72,1.3,0.0,1032.3,10.5,17.0,88.24000000000001,141.18,106.65153374233128,60.46590909090909,141.18,2004-03-16 23:00:00
17/03/2004,00.00.00,1.7,85.0,8.6,248.16,107.0,15.5,52.9,0.9271,0.0,74,3.6,0.0,1032.2,10.1,17.0,85.3,136.28,107.02830265848671,54.89772727272727,136.28,2004-03-17 00:00:00
17/03/2004,01.00.00,1.2,47.0,5.4,178.6,90.0,15.5,51.9,0.9059,0.0,74,4.5,0.0,1032.1,9.6,12.0,47.0,104.92,94.76590909090908,45.0,104.92,2004-03-17 01:00:00
17/03/2004,02.00.00,0.9,34.0,4.1,131.6,79.0,14.1,55.6,0.891,0.0,76,3.7,0.0,1031.7,9.2,9.0,34.0,85.29999999999998,68.59545454545454,39.5,85.29999999999998,2004-03-17 02:00:00
17/03/2004,03.00.00,0.7,26.0,2.6,0.0,0.0,13.1,57.9,0.8666,0.0,29,3.7,0.0,1031.0,8.8,7.0,26.0,60.8,0.0,0.0,60.8,2004-03-17 03:00:00
17/03/2004,04.00.00,0.0,17.0,1.9,101.52,60.0,12.7,57.9,0.8447,0.0,26,3.7,0.0,1030.7,8.5,0.0,17.0,47.5,51.846363636363634,30.0,51.846363636363634,2004-03-17 04:00:00
17/03/2004,05.00.00,0.5,11.0,1.6,52.64,40.0,11.8,58.0,0.8026,0.0,35,4.3,0.0,1030.7,8.2,5.0,11.0,40.0,26.32,20.0,40.0,2004-03-17 05:00:00
17/03/2004,06.00.00,0.5,18.0,1.9,86.47999999999999,53.0,11.9,57.4,0.7978,0.0,100,5.5,74.0,1030.9,8.1,5.0,18.0,47.5,43.239999999999995,26.5,47.5,2004-03-17 06:00:00
17/03/2004,07.00.00,1.6,84.0,7.5,300.79999999999995,84.0,9.9,65.2,0.7956,0.0,100,4.3,297.6,1031.4,10.0,16.0,84.32,125.5,112.30306748466258,42.0,125.5,2004-03-17 07:00:00
17/03/2004,08.00.00,4.1,260.0,21.4,601.5999999999999,108.0,11.1,60.2,0.7958,0.0,8,2.6,539.7,1031.7,12.1,41.0,165.7,188.24,142.44458077709612,55.45454545454545,188.24,2004-03-17 08:00:00
17/03/2004,09.00.00,6.6,534.0,36.4,708.76,127.0,14.1,50.0,0.802,0.0,7,0.8,743.8,1031.7,14.2,66.67999999999999,234.165,313.86,153.86073529411766,66.0340909090909,313.86,2004-03-17 09:00:00
17/03/2004,10.00.00,4.3,368.0,21.3,526.4,134.0,17.7,40.1,0.8048,0.0,7,0.7,895.9,1031.9,16.2,43.0,192.16,187.91333333333333,134.90920245398772,69.93181818181819,192.16,2004-03-17 10:00:00
17/03/2004,11.00.00,2.9,200.0,15.4,415.47999999999996,135.0,21.1,33.4,0.8265,0.0,5,3.6,985.7,1031.5,17.4,29.0,150.0,168.64,123.79451942740286,70.48863636363636,168.64,2004-03-17 11:00:00
17/03/2004,12.00.00,2.5,145.0,12.5,394.79999999999995,142.0,24.3,28.3,0.8471,0.0,0,4.9,1007.0,1030.8,18.3,25.0,123.05,159.16666666666666,121.72229038854806,74.38636363636363,159.16666666666666,2004-03-17 12:00:00
17/03/2004,13.00.00,2.8,188.0,15.1,383.52,153.0,25.6,25.6,0.8254,0.0,0,7.1,958.5,1030.1,18.7,28.0,144.12,167.66,120.59198364008179,80.51136363636363,167.66,2004-03-17 13:00:00
17/03/2004,14.00.00,2.6,152.0,13.7,302.68,123.0,25.9,25.9,0.8503,0.0,1,8.9,843.5,1029.7,18.6,26.0,126.48,163.08666666666667,112.49145194274028,63.80681818181818,163.08666666666667,2004-03-17 14:00:00
17/03/2004,15.00.00,2.0,103.0,10.4,253.79999999999998,104.0,26.8,18.7,0.65,0.0,1,10.0,669.8,1029.5,18.1,20.0,102.47,152.30666666666667,107.59345603271983,53.22727272727273,152.30666666666667,2004-03-17 15:00:00
17/03/2004,16.00.00,2.9,193.0,15.2,349.68,129.0,29.3,15.8,0.6309,0.0,1,9.0,449.3,1029.5,17.1,29.0,146.57,167.98666666666668,117.20106339468302,67.14772727272727,167.98666666666668,2004-03-17 16:00:00
17/03/2004,17.00.00,2.5,134.0,12.3,276.35999999999996,114.0,28.5,14.9,0.5708,0.0,1,4.8,197.0,1029.6,15.6,25.0,117.66,158.51333333333332,109.85406952965235,58.79545454545455,158.51333333333332,2004-03-17 17:00:00
17/03/2004,18.00.00,5.0,386.0,27.0,562.12,158.0,25.9,16.0,0.5237,0.0,45,5.4,22.3,1030.0,14.1,50.0,196.57,220.8,138.4885071574642,83.29545454545453,220.8,2004-03-17 18:00:00
17/03/2004,19.00.00,7.6,577.0,38.4,772.68,194.0,23.1,26.5,0.7403,0.0,72,3.8,0.0,1030.4,13.0,76.47999999999999,244.8075,333.65999999999997,159.61823529411765,101.60122699386503,333.65999999999997,2004-03-17 19:00:00
17/03/2004,20.00.00,6.7,523.0,35.1,652.36,182.0,20.5,38.2,0.9133,0.0,73,2.3,0.0,1030.8,12.1,67.66,231.4425,300.99,147.53096114519428,96.6590909090909,300.99,2004-03-17 20:00:00
17/03/2004,21.00.00,5.7,472.0,27.2,631.68,180.0,19.1,42.6,0.9294,0.0,73,0.7,0.0,1031.0,11.7,57.86,218.82,222.78,145.45873210633945,95.54545454545453,222.78,2004-03-17 21:00:00
17/03/2004,22.00.00,2.8,206.0,15.0,379.76,136.0,17.2,44.1,0.8558,0.0,95,0.8,0.0,1031.2,11.4,28.0,152.47,167.33333333333334,120.21521472392638,71.04545454545455,167.33333333333334,2004-03-17 22:00:00
17/03/2004,23.00.00,2.6,216.0,15.7,334.64,127.0,16.0,50.9,0.9206,0.0,96,1.3,0.0,1031.1,11.1,26.0,154.92,169.62,115.69398773006135,66.0340909090909,169.62,2004-03-17 23:00:00
18/03/2004,00.00.00,2.3,159.0,13.0,289.52,116.0,14.8,53.9,0.9024,0.0,97,2.1,0.0,1030.6,11.2,23.0,129.91,160.8,111.17276073619632,59.90909090909091,160.8,2004-03-18 00:00:00
18/03/2004,01.00.00,1.4,70.0,8.1,172.95999999999998,107.0,14.3,55.4,0.8975,0.0,98,1.8,0.0,1030.9,11.0,14.0,70.6,131.38,91.62545454545453,54.89772727272727,131.38,2004-03-18 01:00:00
18/03/2004,02.00.00,1.0,44.0,5.5,114.67999999999999,88.0,14.8,52.1,0.8686,0.0,99,2.1,0.0,1030.2,10.9,10.0,44.0,105.9,59.17409090909091,44.0,105.9,2004-03-18 02:00:00
18/03/2004,03.00.00,0.7,42.0,3.6,0.0,0.0,13.9,53.9,0.8501,0.0,98,1.6,0.0,1029.8,10.9,7.0,42.0,77.13333333333333,0.0,0.0,77.13333333333333,2004-03-18 03:00:00
18/03/2004,04.00.00,0.0,28.0,2.9,112.8,78.0,11.6,61.9,0.8442,0.0,100,1.3,0.0,1029.6,10.7,0.0,28.0,65.7,58.127272727272725,39.0,65.7,2004-03-18 04:00:00
18/03/2004,05.00.00,0.6,20.0,2.5,69.56,57.0,12.0,58.9,0.8233,0.0,100,1.0,0.0,1029.8,10.7,6.0,20.0,59.166666666666664,34.78,28.5,59.166666666666664,2004-03-18 05:00:00
18/03/2004,06.00.00,0.7,26.0,3.0,127.83999999999999,71.0,10.9,62.1,0.8113,0.0,100,0.8,77.8,1029.9,10.6,7.0,26.0,67.33333333333333,66.50181818181818,35.5,67.33333333333333,2004-03-18 06:00:00
18/03/2004,07.00.00,1.5,78.0,7.7,261.32,85.0,10.6,63.3,0.8067,0.0,59,0.4,304.9,1030.3,11.8,15.0,78.44,127.46000000000001,108.34699386503067,42.5,127.46000000000001,2004-03-18 07:00:00
18/03/2004,08.00.00,4.7,319.0,23.3,637.3199999999999,124.0,11.5,60.0,0.8117,0.0,51,2.0,546.8,1030.6,13.5,47.0,180.155,194.44666666666666,146.02388548057257,64.36363636363636,194.44666666666666,2004-03-18 08:00:00
18/03/2004,09.00.00,6.6,506.0,35.8,791.4799999999999,151.0,14.3,50.6,0.8186,0.0,31,3.1,750.5,1030.5,15.0,66.67999999999999,227.235,307.91999999999996,161.31161764705882,79.39772727272727,307.91999999999996,2004-03-18 09:00:00
18/03/2004,10.00.00,4.5,0.0,21.3,656.12,150.0,17.8,40.5,0.821,0.0,21,2.8,902.3,1030.7,16.4,45.0,0.0,187.91333333333333,147.9077300613497,78.8409090909091,187.91333333333333,2004-03-18 10:00:00
18/03/2004,11.00.00,2.8,0.0,14.3,421.12,152.0,20.8,34.4,0.8365,0.0,7,5.1,991.8,1030.4,17.5,28.0,0.0,165.04666666666668,124.359672801636,79.95454545454545,165.04666666666668,2004-03-18 11:00:00
18/03/2004,12.00.00,2.2,0.0,12.5,321.47999999999996,139.0,23.8,28.2,0.8219,0.0,9,6.9,1012.8,1029.7,18.3,22.0,0.0,159.16666666666666,114.37529652351738,72.7159090909091,159.16666666666666,2004-03-18 12:00:00
18/03/2004,13.00.00,2.2,0.0,12.2,280.12,133.0,24.2,28.7,0.8515,0.0,15,8.9,964.0,1029.3,18.4,22.0,0.0,158.18666666666667,110.23083844580778,69.375,158.18666666666667,2004-03-18 13:00:00
18/03/2004,14.00.00,2.3,0.0,13.1,257.56,126.0,25.2,24.9,0.7829,0.0,19,9.2,848.7,1028.8,18.2,23.0,0.0,161.12666666666667,107.97022494887526,65.47727272727272,161.12666666666667,2004-03-18 14:00:00
18/03/2004,15.00.00,2.2,0.0,14.4,280.12,128.0,27.0,17.8,0.6275,0.0,12,9.7,674.9,1028.6,17.6,22.0,0.0,165.37333333333333,110.23083844580778,66.5909090909091,165.37333333333333,2004-03-18 15:00:00
18/03/2004,16.00.00,2.8,0.0,16.8,323.35999999999996,169.0,27.1,23.1,0.818,0.0,5,8.9,454.3,1028.7,16.7,28.0,0.0,173.21333333333334,114.56368098159508,89.42045454545453,173.21333333333334,2004-03-18 16:00:00
18/03/2004,17.00.00,2.7,0.0,14.5,312.08,149.0,25.8,23.9,0.7832,0.0,6,4.2,202.0,1028.6,15.3,27.0,0.0,165.7,113.43337423312883,78.2840909090909,165.7,2004-03-18 17:00:00
18/03/2004,18.00.00,3.7,0.0,21.5,402.32,156.0,23.0,26.8,0.7446,0.0,3,4.5,24.8,1028.9,13.8,37.0,0.0,188.56666666666666,122.47582822085889,82.18181818181819,188.56666666666666,2004-03-18 18:00:00
18/03/2004,19.00.00,5.1,0.0,26.4,526.4,168.0,20.7,31.1,0.7523,0.0,1,3.0,0.0,1029.1,12.5,51.98,0.0,214.85999999999999,134.90920245398772,88.86363636363636,214.85999999999999,2004-03-18 19:00:00
18/03/2004,20.00.00,5.1,0.0,26.0,518.88,176.0,18.6,36.2,0.7676,0.0,1,1.8,0.0,1029.0,11.4,51.98,0.0,210.9,134.1556646216769,93.31818181818181,210.9,2004-03-18 20:00:00
18/03/2004,21.00.00,3.2,0.0,14.1,334.64,135.0,16.0,48.4,0.8768,0.0,72,2.0,0.0,1029.1,10.5,32.0,0.0,164.39333333333335,115.69398773006135,70.48863636363636,164.39333333333335,2004-03-18 21:00:00
18/03/2004,22.00.00,2.1,0.0,10.3,242.51999999999998,121.0,14.5,57.8,0.9456,0.0,73,3.6,0.0,1029.2,9.9,21.0,0.0,151.98,106.46314928425357,62.69318181818181,151.98,2004-03-18 22:00:00
18/03/2004,23.00.00,1.7,0.0,8.3,178.6,99.0,13.1,64.2,0.9606,0.0,76,1.8,0.0,1029.2,9.6,17.0,0.0,133.34,94.76590909090908,49.5,133.34,2004-03-18 23:00:00
19/03/2004,00.00.00,2.0,0.0,8.9,236.88,106.0,12.0,69.7,0.9735,0.0,97,1.0,0.0,1028.8,9.4,20.0,0.0,139.22,105.89799591002046,54.34090909090909,139.22,2004-03-19 00:00:00
19/03/2004,01.00.00,1.6,0.0,6.6,193.64,96.0,11.9,71.1,0.9915,0.0,96,0.4,0.0,1028.9,9.2,16.0,0.0,116.67999999999999,101.56515337423313,48.0,116.67999999999999,2004-03-19 01:00:00
19/03/2004,02.00.00,0.9,0.0,3.6,90.24,63.0,12.5,69.3,1.0029,0.0,96,0.5,0.0,1028.7,9.2,9.0,0.0,77.13333333333333,45.12,31.5,77.13333333333333,2004-03-19 02:00:00
19/03/2004,03.00.00,0.7,0.0,2.5,0.0,0.0,12.5,67.5,0.9768,0.0,96,0.5,0.0,1028.6,9.6,7.0,0.0,59.166666666666664,0.0,0.0,59.166666666666664,2004-03-19 03:00:00
19/03/2004,04.00.00,0.0,0.0,1.8,37.599999999999994,32.0,12.3,67.7,0.9665,0.0,95,0.4,0.0,1028.5,9.9,0.0,0.0,45.0,18.799999999999997,16.0,45.0,2004-03-19 04:00:00
19/03/2004,05.00.00,0.5,0.0,1.3,33.839999999999996,28.0,12.5,66.8,0.962,0.0,84,0.8,0.0,1028.5,10.0,5.0,0.0,32.5,16.919999999999998,14.0,32.5,2004-03-19 05:00:00
19/03/2004,06.00.00,0.7,0.0,2.3,105.28,61.0,12.3,66.3,0.9487,0.0,83,1.5,81.5,1028.6,10.3,7.0,0.0,55.9,53.94,30.5,55.9,2004-03-19 06:00:00
19/03/2004,07.00.00,1.5,0.0,6.7,216.2,99.0,12.4,64.9,0.9332,0.0,85,2.7,312.2,1029.0,11.1,15.0,0.0,117.66,103.82576687116564,49.5,117.66,2004-03-19 07:00:00
19/03/2004,08.00.00,4.8,0.0,22.8,601.5999999999999,157.0,13.0,61.6,0.9209,0.0,96,2.6,553.8,1029.3,12.1,48.0,0.0,192.81333333333333,142.44458077709612,82.73863636363636,192.81333333333333,2004-03-19 08:00:00
19/03/2004,09.00.00,6.2,0.0,31.3,671.16,166.0,13.6,58.8,0.912,0.0,98,2.7,757.3,1029.5,13.3,62.760000000000005,0.0,263.37,149.41480572597135,87.75,263.37,2004-03-19 09:00:00
19/03/2004,10.00.00,4.0,0.0,19.2,475.64,149.0,13.9,57.1,0.9032,0.0,95,2.9,908.7,1029.3,14.4,40.0,0.0,181.05333333333334,129.82282208588956,78.2840909090909,181.05333333333334,2004-03-19 10:00:00
19/03/2004,11.00.00,3.3,0.0,16.4,409.84,135.0,14.5,54.4,0.8917,0.0,78,4.7,997.8,1029.5,15.5,33.0,0.0,171.90666666666667,123.22936605316973,70.48863636363636,171.90666666666667,2004-03-19 11:00:00
19/03/2004,12.00.00,2.8,0.0,14.0,360.96,127.0,15.5,50.1,0.8744,0.0,57,7.2,1018.5,1028.9,17.0,28.0,0.0,164.06666666666666,118.33137014314929,66.0340909090909,164.06666666666666,2004-03-19 12:00:00
19/03/2004,13.00.00,3.0,0.0,15.3,330.88,122.0,16.1,47.6,0.8655,0.0,76,8.4,969.4,1028.2,17.5,30.0,0.0,168.31333333333333,115.31721881390592,63.25,168.31333333333333,2004-03-19 13:00:00
19/03/2004,14.00.00,3.3,0.0,16.7,372.23999999999995,135.0,16.3,47.1,0.864,0.0,82,9.5,853.9,1027.7,17.4,33.0,0.0,172.88666666666666,119.46167689161554,70.48863636363636,172.88666666666666,2004-03-19 14:00:00
19/03/2004,15.00.00,3.5,0.0,19.0,398.56,139.0,16.4,47.5,0.8791,0.0,91,10.3,679.9,1027.5,16.6,35.0,0.0,180.4,122.09905930470347,72.7159090909091,180.4,2004-03-19 15:00:00
19/03/2004,16.00.00,4.0,0.0,19.4,468.11999999999995,147.0,16.1,50.2,0.9094,0.0,89,10.2,459.2,1027.6,15.5,40.0,0.0,181.70666666666665,129.06928425357873,77.17045454545455,181.70666666666665,2004-03-19 16:00:00
19/03/2004,17.00.00,4.6,0.0,20.9,507.59999999999997,158.0,16.0,50.7,0.9142,0.0,36,7.1,207.0,1027.6,14.1,46.0,0.0,186.60666666666665,133.02535787321062,83.29545454545453,186.60666666666665,2004-03-19 17:00:00
19/03/2004,18.00.00,4.1,0.0,20.2,434.28,146.0,15.8,50.3,0.8989,0.0,15,6.2,27.3,1027.7,12.6,41.0,0.0,184.32,125.67836400817995,76.61363636363636,184.32,2004-03-19 18:00:00
19/03/2004,19.00.00,4.5,0.0,21.7,471.88,144.0,15.5,50.6,0.884,0.0,32,6.9,0.0,1028.1,11.5,45.0,0.0,189.22,129.44605316973414,75.5,189.22,2004-03-19 19:00:00
19/03/2004,20.00.00,3.9,0.0,19.8,394.79999999999995,138.0,15.4,51.4,0.8956,0.0,38,6.2,0.0,1028.2,10.9,39.0,0.0,183.01333333333332,121.72229038854806,72.1590909090909,183.01333333333332,2004-03-19 20:00:00
19/03/2004,21.00.00,4.0,0.0,16.7,468.11999999999995,143.0,15.2,53.1,0.9117,0.0,55,5.8,0.0,1028.9,10.9,40.0,0.0,172.88666666666666,129.06928425357873,74.94318181818181,172.88666666666666,2004-03-19 21:00:00
19/03/2004,22.00.00,2.2,0.0,9.1,268.84,116.0,14.7,57.6,0.9573,0.0,85,4.4,0.0,1029.1,10.9,22.0,0.0,141.18,109.10053169734151,59.90909090909091,141.18,2004-03-19 22:00:00
19/03/2004,23.00.00,2.1,0.0,8.3,238.76,109.0,14.2,58.3,0.938,0.0,82,4.8,0.0,1029.3,10.9,21.0,0.0,133.34,106.08638036809816,56.01136363636363,133.34,2004-03-19 23:00:00
20/03/2004,00.00.00,1.7,0.0,5.8,195.51999999999998,92.0,13.8,57.9,0.9085,0.0,86,3.9,0.0,1028.8,10.8,17.0,0.0,108.84,101.75353783231084,46.0,108.84,2004-03-20 00:00:00
20/03/2004,01.00.00,1.6,0.0,5.2,161.67999999999998,83.0,13.9,55.9,0.8842,0.0,78,3.1,0.0,1028.3,10.7,16.0,0.0,102.96000000000001,85.34454545454544,41.5,102.96000000000001,2004-03-20 01:00:00
20/03/2004,02.00.00,1.3,0.0,4.1,139.12,81.0,13.9,55.6,0.8765,0.0,74,3.6,0.0,1027.9,10.6,13.0,0.0,85.29999999999998,72.78272727272727,40.5,85.29999999999998,2004-03-20 02:00:00
20/03/2004,03.00.00,1.3,0.0,3.4,0.0,0.0,13.8,55.1,0.8666,0.0,80,3.6,0.0,1027.8,10.4,13.0,0.0,73.86666666666666,0.0,0.0,73.86666666666666,2004-03-20 03:00:00
20/03/2004,04.00.00,0.0,0.0,2.9,82.72,55.0,13.8,54.6,0.8574,0.0,76,2.9,0.0,1027.7,10.2,0.0,0.0,65.7,41.36,27.5,65.7,2004-03-20 04:00:00
20/03/2004,05.00.00,0.8,0.0,3.1,78.96,53.0,13.6,55.1,0.856,0.0,75,1.6,0.0,1027.7,10.1,8.0,0.0,68.96666666666667,39.48,26.5,68.96666666666667,2004-03-20 05:00:00
20/03/2004,06.00.00,0.8,0.0,2.5,118.44,67.0,13.6,59.0,0.9129,0.0,98,2.9,85.2,1027.7,9.9,8.0,0.0,59.166666666666664,61.26772727272727,33.5,61.26772727272727,2004-03-20 06:00:00
20/03/2004,07.00.00,1.1,0.0,4.3,216.2,91.0,13.5,58.4,0.896,0.0,95,3.3,319.5,1028.2,11.2,11.0,0.0,88.56666666666666,103.82576687116564,45.5,103.82576687116564,2004-03-20 07:00:00
20/03/2004,08.00.00,2.1,0.0,8.9,319.59999999999997,113.0,13.8,58.0,0.9083,0.0,94,4.6,560.9,1028.3,12.1,21.0,0.0,139.22,114.18691206543967,58.23863636363636,139.22,2004-03-20 08:00:00
20/03/2004,09.00.00,2.4,0.0,10.5,276.35999999999996,102.0,14.6,53.1,0.8765,0.0,100,5.6,764.0,1028.2,12.8,24.0,0.0,152.63333333333333,109.85406952965235,52.11363636363637,152.63333333333333,2004-03-20 09:00:00
20/03/2004,10.00.00,2.6,0.0,12.5,312.08,107.0,15.0,52.3,0.8881,0.0,100,4.1,915.1,1028.4,13.3,26.0,0.0,159.16666666666666,113.43337423312883,54.89772727272727,159.16666666666666,2004-03-20 10:00:00
20/03/2004,11.00.00,2.8,0.0,12.3,366.59999999999997,113.0,15.4,52.1,0.9046,0.0,100,7.2,1003.8,1028.0,13.9,28.0,0.0,158.51333333333332,118.8965235173824,58.23863636363636,158.51333333333332,2004-03-20 11:00:00
20/03/2004,12.00.00,2.6,0.0,11.7,342.15999999999997,108.0,16.3,50.0,0.9158,0.0,99,8.9,1024.2,1028.0,14.4,26.0,0.0,156.55333333333334,116.44752556237219,55.45454545454545,156.55333333333334,2004-03-20 12:00:00
20/03/2004,13.00.00,2.6,0.0,11.7,315.84,105.0,17.1,47.9,0.9281,0.0,100,8.7,974.8,1027.3,14.3,26.0,0.0,156.55333333333334,113.81014314928424,53.78409090909091,156.55333333333334,2004-03-20 13:00:00
20/03/2004,14.00.00,2.1,0.0,9.3,235.0,93.0,19.0,42.9,0.937,0.0,100,7.9,859.0,1026.7,14.2,21.0,0.0,143.14000000000001,105.70961145194273,46.5,143.14000000000001,2004-03-20 14:00:00
20/03/2004,15.00.00,1.7,0.0,7.6,178.6,87.0,19.5,42.3,0.9476,0.0,100,8.2,684.9,1026.1,13.7,17.0,0.0,126.47999999999999,94.76590909090908,43.5,126.47999999999999,2004-03-20 15:00:00
20/03/2004,16.00.00,1.6,0.0,6.7,148.51999999999998,76.0,19.5,42.3,0.9493,0.0,100,8.7,464.1,1026.2,13.3,16.0,0.0,117.66,78.01681818181817,38.0,117.66,2004-03-20 16:00:00
20/03/2004,17.00.00,2.1,0.0,9.7,223.72,94.0,19.1,43.8,0.9556,0.0,100,7.1,211.9,1026.4,12.8,21.0,0.0,147.06,104.57930470347648,47.0,147.06,2004-03-20 17:00:00
20/03/2004,18.00.00,2.3,0.0,12.4,266.96,110.0,18.5,46.3,0.9744,0.0,100,5.5,29.8,1026.4,12.3,23.0,0.0,158.84,108.9121472392638,56.56818181818182,158.84,2004-03-20 18:00:00
20/03/2004,19.00.00,3.5,0.0,16.6,404.2,136.0,17.4,51.6,1.0159,0.0,100,4.5,0.0,1026.5,11.9,35.0,0.0,172.56,122.66421267893661,71.04545454545455,172.56,2004-03-20 19:00:00
20/03/2004,20.00.00,3.9,0.0,16.4,430.52,139.0,17.1,51.3,0.9914,0.0,100,4.0,0.0,1026.7,11.7,39.0,0.0,171.90666666666667,125.30159509202454,72.7159090909091,171.90666666666667,2004-03-20 20:00:00
20/03/2004,21.00.00,3.3,0.0,13.7,387.28,125.0,16.4,53.8,0.9964,0.0,100,4.6,0.0,1026.6,11.4,33.0,0.0,163.08666666666667,120.96875255623722,64.92045454545455,163.08666666666667,2004-03-20 21:00:00
20/03/2004,22.00.00,2.3,0.0,9.9,276.35999999999996,111.0,16.2,55.4,1.0132,0.0,100,4.4,0.0,1026.9,11.3,23.0,0.0,149.02,109.85406952965235,57.125,149.02,2004-03-20 22:00:00
20/03/2004,23.00.00,2.1,0.0,8.9,229.35999999999999,97.0,15.9,57.7,1.0356,0.0,100,5.8,0.0,1026.5,11.3,21.0,0.0,139.22,105.14445807770961,48.5,139.22,2004-03-20 23:00:00
21/03/2004,00.00.00,2.8,0.0,10.6,329.0,107.0,15.7,58.6,1.0396,0.0,100,7.3,0.0,1025.9,11.3,28.0,0.0,152.96,115.12883435582822,54.89772727272727,152.96,2004-03-21 00:00:00
21/03/2004,01.00.00,2.1,0.0,7.4,250.04,90.0,15.1,60.9,1.0398,0.2,100,8.1,0.0,1025.5,11.2,21.0,0.0,124.52000000000001,107.21668711656442,45.0,124.52000000000001,2004-03-21 01:00:00
21/03/2004,02.00.00,1.6,0.0,6.2,167.32,84.0,15.6,56.6,0.9951,0.3,100,9.1,0.0,1024.8,11.2,16.0,0.0,112.76,88.48499999999999,42.0,112.76,2004-03-21 02:00:00
21/03/2004,03.00.00,1.6,0.0,6.5,0.0,0.0,15.2,57.9,0.9941,0.2,100,9.0,0.0,1024.4,11.2,16.0,0.0,115.7,0.0,0.0,115.7,2004-03-21 03:00:00
21/03/2004,04.00.00,0.0,0.0,5.8,159.79999999999998,87.0,15.4,57.8,1.0021,0.2,100,9.3,0.0,1024.0,11.1,0.0,0.0,108.84,84.29772727272726,43.5,108.84,2004-03-21 04:00:00
21/03/2004,05.00.00,1.1,0.0,4.0,103.39999999999999,66.0,14.9,60.6,1.0196,0.1,100,9.3,0.0,1023.9,11.1,11.0,0.0,83.66666666666666,52.893181818181816,33.0,83.66666666666666,2004-03-21 05:00:00
21/03/2004,06.00.00,0.7,0.0,2.1,45.12,36.0,14.5,63.0,1.0316,0.0,100,9.5,89.0,1023.5,11.1,7.0,0.0,52.63333333333333,22.56,18.0,52.63333333333333,2004-03-21 06:00:00
21/03/2004,07.00.00,0.8,0.0,3.6,135.35999999999999,62.0,14.2,66.2,1.063,0.2,99,9.7,326.9,1023.5,11.3,8.0,0.0,77.13333333333333,70.68909090909091,31.0,77.13333333333333,2004-03-21 07:00:00
21/03/2004,08.00.00,1.2,0.0,4.4,229.35999999999999,91.0,14.5,65.3,1.0704,0.0,99,10.9,567.9,1023.4,11.6,12.0,0.0,90.2,105.14445807770961,45.5,105.14445807770961,2004-03-21 08:00:00
21/03/2004,09.00.00,1.4,0.0,5.4,208.67999999999998,89.0,15.3,62.1,1.073,0.1,99,13.0,770.8,1023.5,12.1,14.0,0.0,104.92,103.0722290388548,44.5,104.92,2004-03-21 09:00:00
21/03/2004,10.00.00,1.7,0.0,7.1,231.23999999999998,93.0,16.3,59.0,1.0868,0.2,100,11.9,921.5,1023.3,12.5,17.0,0.0,121.58,105.33284253578732,46.5,121.58,2004-03-21 10:00:00
21/03/2004,11.00.00,1.8,0.0,7.3,199.28,81.0,18.9,49.6,1.07,0.0,99,14.2,1009.8,1022.9,12.7,18.0,0.0,123.53999999999999,102.13030674846625,40.5,123.53999999999999,2004-03-21 11:00:00
21/03/2004,12.00.00,1.8,0.0,7.6,193.64,82.0,19.4,46.1,1.0249,0.2,98,16.0,1029.8,1022.5,13.0,18.0,0.0,126.47999999999999,101.56515337423313,41.0,126.47999999999999,2004-03-21 12:00:00
21/03/2004,13.00.00,1.9,0.0,6.8,191.76,80.0,20.8,41.6,1.0091,0.0,96,15.9,980.1,1021.5,13.3,19.0,0.0,118.64,101.37676891615541,40.0,118.64,2004-03-21 13:00:00
21/03/2004,14.00.00,1.3,0.0,4.6,90.24,48.0,21.4,40.3,1.0126,0.0,97,16.2,864.1,1020.5,13.5,13.0,0.0,93.46666666666665,45.12,24.0,93.46666666666665,2004-03-21 14:00:00
21/03/2004,15.00.00,1.6,0.0,8.4,118.44,61.0,21.2,39.3,0.9791,0.0,93,16.9,689.8,1020.4,13.4,16.0,0.0,134.32,61.26772727272727,30.5,134.32,2004-03-21 15:00:00
21/03/2004,16.00.00,1.9,0.0,6.9,184.23999999999998,89.0,20.3,38.0,0.8942,0.0,83,15.4,469.0,1020.0,13.2,19.0,0.0,119.62,97.90636363636362,44.5,119.62,2004-03-21 16:00:00
21/03/2004,17.00.00,2.3,0.0,9.0,248.16,105.0,19.4,41.3,0.9206,0.0,59,12.6,216.8,1019.4,12.8,23.0,0.0,140.2,107.02830265848671,53.78409090909091,140.2,2004-03-21 17:00:00
21/03/2004,18.00.00,3.8,0.0,15.1,325.24,116.0,18.5,43.8,0.9252,0.0,46,10.8,32.3,1019.5,12.2,38.0,0.0,167.66,114.7520654396728,59.90909090909091,167.66,2004-03-21 18:00:00
21/03/2004,19.00.00,3.5,0.0,12.6,347.79999999999995,119.0,17.8,48.1,0.9689,0.0,98,10.1,0.0,1019.5,11.8,35.0,0.0,159.49333333333334,117.01267893660531,61.57954545454545,159.49333333333334,2004-03-21 19:00:00
21/03/2004,20.00.00,4.3,0.0,15.1,500.08,144.0,17.9,46.9,0.952,0.0,99,10.6,0.0,1019.3,11.7,43.0,0.0,167.66,132.2718200408998,75.5,167.66,2004-03-21 20:00:00
21/03/2004,21.00.00,2.8,0.0,9.9,353.44,123.0,17.4,49.1,0.9688,0.0,97,11.3,0.0,1019.0,11.7,28.0,0.0,149.02,117.57783231083845,63.80681818181818,149.02,2004-03-21 21:00:00
21/03/2004,22.00.00,1.9,0.0,8.0,229.35999999999999,105.0,17.0,51.7,0.9914,0.0,75,12.1,0.0,1019.0,11.6,19.0,0.0,130.4,105.14445807770961,53.78409090909091,130.4,2004-03-21 22:00:00
21/03/2004,23.00.00,1.9,0.0,7.9,210.56,93.0,16.4,55.1,1.0198,0.0,80,12.3,0.0,1018.2,11.5,19.0,0.0,129.42000000000002,103.26061349693252,46.5,129.42000000000002,2004-03-21 23:00:00
22/03/2004,00.00.00,1.7,0.0,6.1,174.84,86.0,16.1,60.0,1.0919,0.0,83,12.3,0.0,1017.8,11.5,17.0,0.0,111.78,92.67227272727273,43.0,111.78,2004-03-22 00:00:00
22/03/2004,01.00.00,1.5,0.0,5.1,139.12,76.0,15.8,60.5,1.0805,0.0,97,12.6,0.0,1017.1,11.6,15.0,0.0,101.97999999999999,72.78272727272727,38.0,101.97999999999999,2004-03-22 01:00:00
22/03/2004,02.00.00,0.6,0.0,1.7,43.239999999999995,33.0,16.3,57.0,1.0491,0.1,89,13.0,0.0,1016.2,11.6,6.0,0.0,42.5,21.619999999999997,16.5,42.5,2004-03-22 02:00:00
22/03/2004,03.00.00,0.4,0.0,0.7,0.0,0.0,16.9,53.9,1.0309,0.0,91,13.0,0.0,1015.9,11.4,4.0,0.0,17.5,0.0,0.0,17.5,2004-03-22 03:00:00
22/03/2004,04.00.00,0.0,0.0,0.8,31.959999999999997,27.0,16.1,55.9,1.0153,0.0,98,11.7,0.0,1015.3,11.3,0.0,0.0,20.0,15.979999999999999,13.5,20.0,2004-03-22 04:00:00
22/03/2004,05.00.00,0.3,0.0,0.7,28.2,23.0,16.5,53.9,1.0049,0.0,100,11.3,0.0,1015.3,11.3,3.0,0.0,17.5,14.1,11.5,17.5,2004-03-22 05:00:00
22/03/2004,06.00.00,0.6,0.0,2.0,77.08,46.0,16.4,54.0,0.9979,0.0,100,12.3,92.8,1015.1,11.4,6.0,0.0,50.0,38.54,23.0,50.0,2004-03-22 06:00:00
22/03/2004,07.00.00,1.2,0.0,5.1,161.67999999999998,76.0,15.7,57.6,1.0195,0.0,85,15.1,334.2,1015.0,11.8,12.0,0.0,101.97999999999999,85.34454545454544,38.0,101.97999999999999,2004-03-22 07:00:00
22/03/2004,08.00.00,3.6,0.0,17.7,424.88,116.0,15.8,53.7,0.9571,0.0,98,17.6,575.0,1014.9,12.4,36.0,0.0,176.15333333333334,124.73644171779141,59.90909090909091,176.15333333333334,2004-03-22 08:00:00
22/03/2004,09.00.00,3.7,0.0,18.4,402.32,115.0,17.4,42.1,0.8281,0.0,99,19.1,777.5,1014.9,12.9,37.0,0.0,178.44,122.47582822085889,59.35227272727273,178.44,2004-03-22 09:00:00
22/03/2004,10.00.00,1.8,0.0,6.9,216.2,83.0,17.9,38.4,0.7793,0.1,75,18.6,927.8,1014.9,13.6,18.0,0.0,119.62,103.82576687116564,41.5,119.62,2004-03-22 10:00:00
22/03/2004,11.00.00,1.6,0.0,7.3,233.11999999999998,87.0,18.5,36.7,0.7764,0.0,82,19.1,1015.8,1014.4,14.5,16.0,0.0,123.53999999999999,105.52122699386503,43.5,123.53999999999999,2004-03-22 11:00:00
22/03/2004,12.00.00,1.9,0.0,9.6,229.35999999999999,90.0,21.0,29.6,0.7263,0.0,92,19.2,1035.4,1014.0,14.8,19.0,0.0,146.07999999999998,105.14445807770961,45.0,146.07999999999998,2004-03-22 12:00:00
22/03/2004,13.00.00,2.0,0.0,10.4,201.16,87.0,21.3,28.1,0.7067,0.0,92,19.0,985.4,1013.4,15.5,20.0,0.0,152.30666666666667,102.31869120654396,43.5,152.30666666666667,2004-03-22 13:00:00
22/03/2004,14.00.00,2.2,0.0,11.2,250.04,99.0,21.3,26.1,0.6539,0.0,96,18.9,869.2,1013.0,15.4,22.0,0.0,154.92,107.21668711656442,49.5,154.92,2004-03-22 14:00:00
22/03/2004,15.00.00,2.1,0.0,10.7,244.39999999999998,99.0,21.3,26.8,0.6681,0.0,100,17.9,694.7,1012.8,15.0,21.0,0.0,153.28666666666666,106.65153374233128,49.5,153.28666666666666,2004-03-22 15:00:00
22/03/2004,16.00.00,2.3,451.0,11.6,282.0,101.0,21.3,24.2,0.606,0.0,100,16.9,473.8,1012.7,14.2,23.0,213.6225,156.22666666666666,110.41922290388548,51.55681818181818,213.6225,2004-03-22 16:00:00
22/03/2004,17.00.00,2.6,185.0,12.4,259.44,103.0,20.2,28.5,0.6682,0.0,100,14.2,221.7,1012.5,13.3,26.0,142.65,158.84,108.15860940695296,52.67045454545455,158.84,2004-03-22 17:00:00
22/03/2004,18.00.00,3.8,426.0,18.3,400.44,129.0,17.0,43.1,0.8264,0.0,100,11.9,34.8,1012.5,12.5,38.0,207.435,178.11333333333334,122.28744376278118,67.14772727272727,207.435,2004-03-22 18:00:00
22/03/2004,19.00.00,4.4,672.0,21.0,436.15999999999997,143.0,15.6,47.4,0.8347,0.0,100,10.8,0.0,1012.8,12.1,44.0,268.32,186.93333333333334,125.86674846625766,74.94318181818181,268.32,2004-03-22 19:00:00
22/03/2004,20.00.00,4.5,624.0,21.0,447.44,146.0,15.3,47.4,0.8178,0.0,100,9.4,0.0,1012.6,11.8,45.0,256.44,186.93333333333334,126.99705521472393,76.61363636363636,256.44,2004-03-22 20:00:00
22/03/2004,21.00.00,3.3,325.0,14.5,338.4,124.0,14.5,49.7,0.8177,0.0,100,8.8,0.0,1012.4,11.6,33.0,181.625,165.7,116.07075664621676,64.36363636363636,181.625,2004-03-22 21:00:00
22/03/2004,22.00.00,2.0,143.0,8.4,240.64,113.0,13.9,52.0,0.8231,0.1,100,4.1,0.0,1011.4,11.4,20.0,122.07,134.32,106.27476482617587,58.23863636363636,134.32,2004-03-22 22:00:00
22/03/2004,23.00.00,1.1,89.0,4.3,122.19999999999999,80.0,14.5,49.4,0.8106,0.2,100,4.4,0.0,1010.5,11.1,11.0,89.22,88.56666666666666,63.36136363636363,40.0,89.22,2004-03-22 23:00:00
23/03/2004,00.00.00,0.9,73.0,3.8,99.64,72.0,13.8,51.4,0.8071,0.2,99,4.6,0.0,1009.8,10.8,9.0,73.53999999999999,80.39999999999999,49.82,36.0,80.39999999999999,2004-03-23 00:00:00
23/03/2004,01.00.00,0.8,48.0,2.7,88.36,64.0,14.0,51.3,0.8163,0.1,100,3.1,0.0,1008.7,10.6,8.0,48.0,62.43333333333334,44.18,32.0,62.43333333333334,2004-03-23 01:00:00
23/03/2004,02.00.00,0.7,47.0,2.5,95.88,70.0,13.0,56.8,0.8444,0.0,100,3.1,0.0,1007.7,10.5,7.0,47.0,59.166666666666664,47.94,35.0,59.166666666666664,2004-03-23 02:00:00
23/03/2004,03.00.00,0.5,36.0,1.2,0.0,0.0,11.0,70.0,0.9215,0.0,100,2.2,0.0,1006.8,10.4,5.0,36.0,30.0,0.0,0.0,36.0,2004-03-23 03:00:00
23/03/2004,04.00.00,0.0,25.0,0.8,37.599999999999994,31.0,10.1,76.8,0.9483,0.5,100,1.8,0.0,1006.1,10.2,0.0,25.0,20.0,18.799999999999997,15.5,25.0,2004-03-23 04:00:00
23/03/2004,05.00.00,0.3,19.0,0.6,24.439999999999998,22.0,8.8,80.5,0.9147,1.0,100,3.1,0.0,1005.9,10.1,3.0,19.0,15.0,12.219999999999999,11.0,19.0,2004-03-23 05:00:00
23/03/2004,06.00.00,0.5,26.0,1.8,62.04,47.0,9.6,75.4,0.9004,1.2,100,4.3,96.5,1005.5,10.0,5.0,26.0,45.0,31.02,23.5,45.0,2004-03-23 06:00:00
23/03/2004,07.00.00,1.1,60.0,4.6,193.64,88.0,9.8,75.0,0.9093,0.5,99,5.8,341.6,1005.4,10.2,11.0,60.8,93.46666666666665,101.56515337423313,44.0,101.56515337423313,2004-03-23 07:00:00
23/03/2004,08.00.00,3.0,248.0,14.2,421.12,130.0,10.0,74.2,0.9117,0.3,96,8.7,582.1,1005.1,10.9,30.0,162.76,164.72,124.359672801636,67.70454545454545,164.72,2004-03-23 08:00:00
23/03/2004,09.00.00,3.8,535.0,21.0,458.71999999999997,132.0,11.2,69.7,0.9232,0.0,96,7.3,784.2,1004.4,11.8,38.0,234.4125,186.93333333333334,128.12736196319017,68.81818181818181,234.4125,2004-03-23 09:00:00
23/03/2004,10.00.00,3.4,340.0,16.2,445.56,132.0,12.0,62.9,0.8803,0.1,100,10.3,934.1,1004.4,13.5,34.0,185.3,171.25333333333333,126.80867075664622,68.81818181818181,185.3,2004-03-23 10:00:00
23/03/2004,11.00.00,3.0,325.0,15.5,413.59999999999997,131.0,12.8,55.8,0.821,0.1,99,11.2,1021.7,1004.2,13.8,30.0,181.625,168.96666666666667,123.60613496932515,68.26136363636363,181.625,2004-03-23 11:00:00
23/03/2004,12.00.00,2.7,267.0,13.4,389.15999999999997,129.0,13.1,54.8,0.8234,0.0,93,11.5,1040.9,1003.4,13.8,27.0,167.415,162.10666666666665,121.15713701431493,67.14772727272727,167.415,2004-03-23 12:00:00
23/03/2004,13.00.00,3.5,325.0,16.9,391.03999999999996,132.0,13.8,53.4,0.8351,0.0,100,11.3,990.6,1002.8,13.9,35.0,181.625,173.54,121.34552147239263,68.81818181818181,181.625,2004-03-23 13:00:00
23/03/2004,14.00.00,2.8,268.0,12.4,300.79999999999995,110.0,16.0,42.4,0.7674,0.1,98,12.5,874.2,1002.5,14.0,28.0,167.66,158.84,112.30306748466258,56.56818181818182,167.66,2004-03-23 14:00:00
23/03/2004,15.00.00,1.9,136.0,10.1,246.27999999999997,99.0,14.1,49.8,0.7971,0.0,95,15.3,699.5,1002.5,13.8,19.0,118.64,151.32666666666665,106.83991820040899,49.5,151.32666666666665,2004-03-23 15:00:00
23/03/2004,16.00.00,2.0,118.0,8.7,240.64,100.0,12.0,61.1,0.8537,0.0,36,15.3,478.6,1002.4,13.1,20.0,109.82,137.26,106.27476482617587,50.0,137.26,2004-03-23 16:00:00
23/03/2004,17.00.00,3.0,276.0,13.8,330.88,122.0,13.6,54.6,0.8465,0.0,41,12.8,226.6,1002.3,12.1,30.0,169.62,163.41333333333333,115.31721881390592,63.25,169.62,2004-03-23 17:00:00
23/03/2004,18.00.00,1.9,151.0,9.3,201.16,97.0,13.7,49.5,0.7695,0.0,37,9.4,37.2,1002.3,11.2,19.0,125.99,143.14000000000001,102.31869120654396,48.5,143.14000000000001,2004-03-23 18:00:00
23/03/2004,19.00.00,2.7,236.0,13.0,246.27999999999997,112.0,11.7,57.1,0.7822,0.0,31,7.1,0.0,1002.8,10.5,27.0,159.82,160.8,106.83991820040899,57.68181818181818,160.8,2004-03-23 19:00:00
23/03/2004,20.00.00,3.3,220.0,14.3,312.08,128.0,11.5,58.2,0.7867,0.0,39,4.7,0.0,1002.5,9.8,33.0,155.9,165.04666666666668,113.43337423312883,66.5909090909091,165.04666666666668,2004-03-23 20:00:00
23/03/2004,21.00.00,1.7,87.0,7.6,167.32,101.0,12.6,54.2,0.7881,0.0,44,4.1,0.0,1002.4,9.2,17.0,87.25999999999999,126.47999999999999,88.48499999999999,51.55681818181818,126.47999999999999,2004-03-23 21:00:00
23/03/2004,22.00.00,1.3,81.0,5.3,152.28,96.0,12.0,54.9,0.7664,0.1,80,5.9,0.0,1002.4,8.8,13.0,81.38,103.94,80.11045454545454,48.0,103.94,2004-03-23 22:00:00
23/03/2004,23.00.00,1.3,74.0,5.4,146.64,86.0,11.0,61.4,0.8057,0.0,69,7.8,0.0,1001.8,8.6,13.0,74.52,104.92,76.97,43.0,104.92,2004-03-23 23:00:00
24/03/2004,00.00.00,1.2,55.0,4.9,131.6,85.0,11.1,62.2,0.8199,0.0,52,6.8,0.0,1001.4,8.2,12.0,55.9,98.36666666666667,68.59545454545454,42.5,98.36666666666667,2004-03-24 00:00:00
24/03/2004,01.00.00,1.1,74.0,4.6,142.88,79.0,10.8,62.5,0.8082,0.0,40,6.5,0.0,1001.2,7.9,11.0,74.52,93.46666666666665,74.87636363636364,39.5,93.46666666666665,2004-03-24 01:00:00
24/03/2004,02.00.00,0.9,35.0,2.7,80.83999999999999,61.0,11.3,60.0,0.8025,0.1,65,2.9,0.0,1001.4,7.5,9.0,35.0,62.43333333333334,40.419999999999995,30.5,62.43333333333334,2004-03-24 02:00:00
24/03/2004,03.00.00,0.6,29.0,1.6,0.0,0.0,10.6,61.6,0.7856,0.2,66,2.4,0.0,1001.7,7.1,6.0,29.0,40.0,0.0,0.0,40.0,2004-03-24 03:00:00
24/03/2004,04.00.00,0.0,29.0,1.7,82.72,66.0,10.2,62.7,0.7813,0.0,82,2.3,0.0,1001.8,7.1,0.0,29.0,42.5,41.36,33.0,42.5,2004-03-24 04:00:00
24/03/2004,05.00.00,0.6,20.0,1.2,63.919999999999995,54.0,10.9,58.6,0.7628,0.0,92,3.0,0.0,1002.4,6.9,6.0,20.0,30.0,31.959999999999997,27.0,31.959999999999997,2004-03-24 05:00:00
24/03/2004,06.00.00,0.8,32.0,1.7,80.83999999999999,57.0,10.8,57.2,0.7382,0.0,92,3.9,100.3,1002.7,7.0,8.0,32.0,42.5,40.419999999999995,28.5,42.5,2004-03-24 06:00:00
24/03/2004,07.00.00,1.2,84.0,4.8,148.51999999999998,75.0,10.4,59.2,0.7455,0.0,91,5.9,349.0,1003.3,8.6,12.0,84.32,96.73333333333332,78.01681818181817,37.5,96.73333333333332,2004-03-24 07:00:00
24/03/2004,08.00.00,3.1,245.0,13.8,327.12,97.0,11.0,57.3,0.7501,0.1,78,8.8,589.1,1004.0,9.6,31.0,162.025,163.41333333333333,114.94044989775051,48.5,163.41333333333333,2004-03-24 08:00:00
24/03/2004,09.00.00,4.4,553.0,23.7,441.79999999999995,110.0,11.2,56.9,0.7565,0.2,78,8.6,790.8,1004.5,10.6,44.0,238.8675,195.75333333333333,126.4319018404908,56.56818181818182,238.8675,2004-03-24 09:00:00
24/03/2004,10.00.00,3.4,450.0,14.2,409.84,113.0,12.1,54.9,0.7734,0.3,66,10.0,940.4,1005.0,11.6,34.0,213.375,164.72,123.22936605316973,58.23863636363636,213.375,2004-03-24 10:00:00
24/03/2004,11.00.00,1.7,118.0,8.0,255.67999999999998,88.0,15.1,44.3,0.7535,0.3,80,10.5,1027.5,1005.7,11.9,17.0,109.82,130.4,107.78184049079755,44.0,130.4,2004-03-24 11:00:00
24/03/2004,12.00.00,1.5,118.0,6.7,219.95999999999998,85.0,15.6,40.6,0.7146,0.3,40,8.7,1046.4,1005.7,12.5,15.0,109.82,117.66,104.20253578732107,42.5,117.66,2004-03-24 12:00:00
24/03/2004,13.00.00,1.7,144.0,8.7,223.72,96.0,16.9,34.6,0.6597,0.2,39,10.5,995.8,1005.8,12.6,17.0,122.56,137.26,104.57930470347648,48.0,137.26,2004-03-24 13:00:00
24/03/2004,14.00.00,2.2,159.0,10.8,236.88,106.0,16.6,35.6,0.6697,0.1,42,12.5,879.1,1006.1,12.4,22.0,129.91,153.61333333333334,105.89799591002046,54.34090909090909,153.61333333333334,2004-03-24 14:00:00
24/03/2004,15.00.00,0.0,122.0,6.7,188.0,91.0,11.3,63.9,0.8554,0.0,39,12.7,704.3,1006.4,12.4,0.0,111.78,117.66,100.0,45.5,117.66,2004-03-24 15:00:00
24/03/2004,16.00.00,2.7,230.0,11.4,370.35999999999996,126.0,9.6,81.1,0.972,0.0,41,14.0,483.4,1006.7,11.9,27.0,158.35,155.57333333333332,119.27329243353782,65.47727272727272,158.35,2004-03-24 16:00:00
24/03/2004,17.00.00,2.8,320.0,13.4,366.59999999999997,130.0,11.7,69.1,0.9497,0.0,63,14.3,231.4,1007.4,11.2,28.0,180.4,162.10666666666665,118.8965235173824,67.70454545454545,180.4,2004-03-24 17:00:00
24/03/2004,18.00.00,2.7,263.0,12.0,293.28,111.0,10.7,68.5,0.8794,0.0,53,11.2,39.7,1007.8,10.4,27.0,166.435,157.53333333333333,111.54952965235174,57.125,166.435,2004-03-24 18:00:00
24/03/2004,19.00.00,4.5,556.0,20.2,464.35999999999996,134.0,10.7,67.3,0.8643,0.0,56,8.5,0.0,1008.7,10.0,45.0,239.61,184.32,128.69251533742332,69.93181818181819,239.61,2004-03-24 19:00:00
24/03/2004,20.00.00,3.5,458.0,14.4,357.2,136.0,10.8,65.7,0.8486,0.2,80,7.4,0.0,1009.1,9.7,35.0,215.355,165.37333333333333,117.95460122699386,71.04545454545455,215.355,2004-03-24 20:00:00
24/03/2004,21.00.00,2.6,214.0,9.4,317.71999999999997,125.0,10.3,66.3,0.8336,0.2,91,7.4,0.0,1009.7,9.4,26.0,154.43,144.12,113.99852760736196,64.92045454545455,154.43,2004-03-24 21:00:00
24/03/2004,22.00.00,1.7,97.0,5.9,221.83999999999997,108.0,10.1,66.9,0.8248,0.4,58,11.2,0.0,1010.0,9.3,17.0,97.06,109.82000000000001,104.39092024539877,55.45454545454545,109.82000000000001,2004-03-24 22:00:00
24/03/2004,23.00.00,1.3,79.0,4.5,152.28,87.0,10.4,61.1,0.7717,0.2,68,8.2,0.0,1010.4,9.1,13.0,79.42,91.83333333333333,80.11045454545454,43.5,91.83333333333333,2004-03-24 23:00:00
25/03/2004,00.00.00,1.3,81.0,4.5,150.39999999999998,89.0,10.3,59.9,0.7516,0.3,43,4.8,0.0,1010.6,9.0,13.0,81.38,91.83333333333333,79.06363636363635,44.5,91.83333333333333,2004-03-25 00:00:00
25/03/2004,01.00.00,1.0,52.0,2.5,78.96,58.0,11.0,58.4,0.7686,0.3,59,5.8,0.0,1010.7,8.8,10.0,52.96,59.166666666666664,39.48,29.0,59.166666666666664,2004-03-25 01:00:00
25/03/2004,02.00.00,0.7,38.0,1.8,71.44,54.0,9.1,68.1,0.789,0.3,93,4.7,0.0,1010.5,8.6,7.0,38.0,45.0,35.72,27.0,45.0,2004-03-25 02:00:00
25/03/2004,03.00.00,0.7,35.0,1.4,0.0,0.0,9.5,68.2,0.8091,0.2,70,4.0,0.0,1010.4,8.6,7.0,35.0,35.0,0.0,0.0,35.0,2004-03-25 03:00:00
25/03/2004,04.00.00,0.5,29.0,0.9,33.839999999999996,28.0,9.3,72.3,0.8496,0.0,88,4.5,0.0,1010.3,8.6,5.0,29.0,22.5,16.919999999999998,14.0,29.0,2004-03-25 04:00:00
25/03/2004,05.00.00,0.5,21.0,0.6,22.56,20.0,9.9,66.8,0.8152,0.0,97,5.4,0.0,1010.8,8.6,5.0,21.0,15.0,11.28,10.0,21.0,2004-03-25 05:00:00
25/03/2004,06.00.00,0.6,46.0,1.4,80.83999999999999,51.0,7.6,83.2,0.8695,0.0,95,5.5,104.1,1010.7,8.7,6.0,46.0,35.0,40.419999999999995,25.5,46.0,2004-03-25 06:00:00
25/03/2004,07.00.00,1.1,55.0,3.8,157.92,82.0,8.1,79.0,0.8544,0.2,51,8.0,356.4,1010.9,9.3,11.0,55.9,80.39999999999999,83.25090909090909,41.0,83.25090909090909,2004-03-25 07:00:00
25/03/2004,08.00.00,2.7,271.0,11.6,345.91999999999996,112.0,8.7,74.6,0.8429,0.1,49,14.0,596.2,1011.1,10.2,27.0,168.395,156.22666666666666,116.8242944785276,57.68181818181818,168.395,2004-03-25 08:00:00
25/03/2004,09.00.00,3.5,434.0,17.8,379.76,119.0,8.6,75.1,0.8415,0.0,42,19.1,797.5,1011.4,11.2,35.0,209.415,176.48,120.21521472392638,61.57954545454545,209.415,2004-03-25 09:00:00
25/03/2004,10.00.00,2.3,300.0,8.8,250.04,99.0,9.7,69.7,0.8389,0.0,41,20.1,946.6,1011.3,12.5,23.0,175.5,138.24,107.21668711656442,49.5,175.5,2004-03-25 10:00:00
25/03/2004,11.00.00,1.6,116.0,6.8,244.39999999999998,98.0,11.0,64.4,0.8447,0.0,33,19.9,1033.3,1011.4,13.3,16.0,108.84,118.64,106.65153374233128,49.0,118.64,2004-03-25 11:00:00
25/03/2004,12.00.00,1.3,95.0,5.9,199.28,88.0,13.6,53.0,0.8209,0.0,34,19.9,1051.9,1010.7,13.8,13.0,95.1,109.82000000000001,102.13030674846625,44.0,109.82000000000001,2004-03-25 12:00:00
25/03/2004,13.00.00,2.0,211.0,8.9,248.16,96.0,14.2,48.4,0.778,0.0,30,19.9,1000.9,1010.6,14.0,20.0,153.695,139.22,107.02830265848671,48.0,153.695,2004-03-25 13:00:00
25/03/2004,14.00.00,1.9,168.0,8.2,199.28,81.0,14.2,46.3,0.7438,0.0,37,19.7,884.0,1010.3,13.5,19.0,134.32,132.35999999999999,102.13030674846625,40.5,134.32,2004-03-25 14:00:00
25/03/2004,15.00.00,1.9,154.0,8.6,235.0,92.0,16.0,41.3,0.7462,0.0,37,18.7,709.1,1010.1,13.0,19.0,127.46000000000001,136.28,105.70961145194273,46.0,136.28,2004-03-25 15:00:00
25/03/2004,16.00.00,2.2,267.0,10.1,259.44,105.0,17.7,35.4,0.7094,0.0,57,16.3,488.1,1010.0,12.4,22.0,167.415,151.32666666666665,108.15860940695296,53.78409090909091,167.415,2004-03-25 16:00:00
25/03/2004,17.00.00,2.0,143.0,9.4,225.6,88.0,17.1,37.4,0.7225,0.0,65,12.7,236.2,1009.9,11.5,20.0,122.07,144.12,104.76768916155419,44.0,144.12,2004-03-25 17:00:00
25/03/2004,18.00.00,2.9,374.0,14.6,297.03999999999996,103.0,14.9,40.5,0.6835,0.0,53,10.2,42.1,1010.0,10.6,29.0,193.63,166.02666666666667,111.92629856850715,52.67045454545455,193.63,2004-03-25 18:00:00
25/03/2004,19.00.00,5.2,797.0,24.6,475.64,141.0,13.4,47.8,0.7293,0.0,53,7.2,0.0,1010.2,10.1,52.96,299.2575,198.69333333333333,129.82282208588956,73.82954545454545,299.2575,2004-03-25 19:00:00
25/03/2004,20.00.00,4.6,698.0,21.6,434.28,133.0,12.6,52.5,0.7642,0.0,48,5.4,0.0,1010.3,9.7,46.0,274.755,188.89333333333335,125.67836400817995,69.375,274.755,2004-03-25 20:00:00
25/03/2004,21.00.00,2.5,234.0,10.3,282.0,119.0,12.2,53.2,0.7555,0.1,57,6.1,0.0,1010.7,9.2,25.0,159.33,151.98,110.41922290388548,61.57954545454545,159.33,2004-03-25 21:00:00
25/03/2004,22.00.00,1.5,104.0,5.7,186.11999999999998,106.0,10.6,56.1,0.714,0.0,61,4.6,0.0,1010.7,8.7,15.0,102.96,107.86,98.9531818181818,54.34090909090909,107.86,2004-03-25 22:00:00
25/03/2004,23.00.00,1.2,67.0,4.5,141.0,92.0,9.9,59.5,0.7276,0.0,50,3.2,0.0,1010.6,8.3,12.0,67.66,91.83333333333333,73.82954545454545,46.0,91.83333333333333,2004-03-25 23:00:00
26/03/2004,00.00.00,1.7,88.0,5.5,174.84,97.0,9.6,61.1,0.7323,0.0,81,3.1,0.0,1010.3,7.7,17.0,88.24000000000001,105.9,92.67227272727273,48.5,105.9,2004-03-26 00:00:00
26/03/2004,01.00.00,1.4,79.0,4.8,148.51999999999998,91.0,9.7,61.6,0.7425,0.0,84,3.6,0.0,1009.9,7.6,14.0,79.42,96.73333333333332,78.01681818181817,45.5,96.73333333333332,2004-03-26 01:00:00
26/03/2004,02.00.00,1.2,61.0,3.6,125.96,83.0,9.4,62.6,0.7398,0.0,54,3.7,0.0,1009.0,7.7,12.0,61.78,77.13333333333333,65.455,41.5,77.13333333333333,2004-03-26 02:00:00
26/03/2004,03.00.00,0.6,43.0,1.7,0.0,0.0,8.2,68.5,0.7455,0.0,45,4.4,0.0,1008.7,7.6,6.0,43.0,42.5,0.0,0.0,43.0,2004-03-26 03:00:00
26/03/2004,04.00.00,0.7,40.0,2.2,84.6,59.0,8.0,69.4,0.7459,0.0,52,5.8,0.0,1008.3,7.5,7.0,40.0,54.266666666666666,42.3,29.5,54.266666666666666,2004-03-26 04:00:00
26/03/2004,05.00.00,0.8,52.0,3.0,135.35999999999999,73.0,7.7,72.4,0.7655,0.0,80,6.1,0.0,1008.0,7.4,8.0,52.96,67.33333333333333,70.68909090909091,36.5,70.68909090909091,2004-03-26 05:00:00
26/03/2004,06.00.00,0.9,64.0,4.0,193.64,78.0,8.0,71.8,0.7711,0.0,95,7.6,107.9,1007.7,7.6,9.0,64.72,83.66666666666666,101.56515337423313,39.0,101.56515337423313,2004-03-26 06:00:00
26/03/2004,07.00.00,1.6,88.0,6.7,248.16,90.0,8.5,66.3,0.7375,0.0,85,5.1,363.7,1007.6,8.8,16.0,88.24000000000001,117.66,107.02830265848671,45.0,117.66,2004-03-26 07:00:00
26/03/2004,08.00.00,3.4,375.0,16.7,449.32,110.0,9.8,59.6,0.7214,0.0,83,3.1,603.2,1007.6,10.3,34.0,193.875,172.88666666666666,127.18543967280164,56.56818181818182,193.875,2004-03-26 08:00:00
26/03/2004,09.00.00,3.8,592.0,19.3,517.0,114.0,11.2,57.0,0.7544,0.1,62,3.3,804.1,1007.6,11.9,38.0,248.51999999999998,181.38,133.96728016359918,58.79545454545455,248.51999999999998,2004-03-26 09:00:00
26/03/2004,10.00.00,3.1,357.0,14.8,436.15999999999997,119.0,14.8,44.1,0.7407,0.3,48,3.1,952.7,1007.2,12.6,31.0,189.465,166.68,125.86674846625766,61.57954545454545,189.465,2004-03-26 10:00:00
26/03/2004,11.00.00,2.7,296.0,13.4,338.4,121.0,16.8,35.3,0.6729,0.3,47,5.5,1039.1,1007.0,13.5,27.0,174.52,162.10666666666665,116.07075664621676,62.69318181818181,174.52,2004-03-26 11:00:00
26/03/2004,12.00.00,2.0,181.0,11.0,210.56,97.0,19.2,27.1,0.5976,0.2,52,7.9,1057.2,1006.5,13.7,20.0,140.69,154.26666666666668,103.26061349693252,48.5,154.26666666666668,2004-03-26 12:00:00
26/03/2004,13.00.00,2.3,211.0,12.5,218.07999999999998,99.0,19.1,26.2,0.5741,0.2,34,10.1,1006.0,1006.1,14.2,23.0,153.695,159.16666666666666,104.01415132924335,49.5,159.16666666666666,2004-03-26 13:00:00
26/03/2004,14.00.00,1.9,199.0,8.4,193.64,85.0,16.3,30.8,0.5683,0.0,37,11.1,888.8,1005.9,14.0,19.0,149.51,134.32,101.56515337423313,42.5,149.51,2004-03-26 14:00:00
26/03/2004,15.00.00,1.3,81.0,5.3,167.32,75.0,14.2,36.8,0.5922,0.0,18,11.4,713.7,1005.7,13.4,13.0,81.38,103.94,88.48499999999999,37.5,103.94,2004-03-26 15:00:00
26/03/2004,16.00.00,1.9,143.0,8.8,210.56,87.0,13.4,41.0,0.6292,0.0,15,10.5,492.8,1005.6,12.7,19.0,122.07,138.24,103.26061349693252,43.5,138.24,2004-03-26 16:00:00
26/03/2004,17.00.00,2.3,247.0,11.2,238.76,102.0,14.2,43.3,0.6982,0.0,18,6.8,241.0,1005.6,11.7,23.0,162.515,154.92,106.08638036809816,52.11363636363637,162.515,2004-03-26 17:00:00
26/03/2004,18.00.00,2.4,239.0,11.6,235.0,105.0,12.1,45.6,0.6403,0.0,19,6.5,44.6,1005.8,10.4,24.0,160.555,156.22666666666666,105.70961145194273,53.78409090909091,160.555,2004-03-26 18:00:00
26/03/2004,19.00.00,2.7,267.0,12.4,225.6,98.0,10.4,48.0,0.6046,0.0,21,5.4,0.0,1006.5,9.6,27.0,167.415,158.84,104.76768916155419,49.0,167.415,2004-03-26 19:00:00
26/03/2004,20.00.00,2.6,261.0,10.6,225.6,93.0,10.0,51.1,0.628,0.0,8,2.8,0.0,1006.9,8.5,26.0,165.945,152.96,104.76768916155419,46.5,165.945,2004-03-26 20:00:00
26/03/2004,21.00.00,1.5,97.0,6.0,186.11999999999998,91.0,9.8,50.8,0.6172,0.0,14,1.6,0.0,1007.2,7.8,15.0,97.06,110.8,98.9531818181818,45.5,110.8,2004-03-26 21:00:00
26/03/2004,22.00.00,1.2,66.0,4.6,148.51999999999998,85.0,9.7,50.4,0.6063,0.0,41,0.4,0.0,1007.4,7.3,12.0,66.68,93.46666666666665,78.01681818181817,42.5,93.46666666666665,2004-03-26 22:00:00
26/03/2004,23.00.00,1.1,60.0,4.1,124.08,74.0,9.9,50.2,0.6103,0.0,41,3.5,0.0,1008.1,6.8,11.0,60.8,85.29999999999998,64.40818181818182,37.0,85.29999999999998,2004-03-26 23:00:00
27/03/2004,00.00.00,1.5,77.0,5.2,176.72,87.0,9.4,53.4,0.63,0.0,27,4.0,0.0,1007.5,6.5,15.0,77.46000000000001,102.96000000000001,93.71909090909091,43.5,102.96000000000001,2004-03-27 00:00:00
27/03/2004,01.00.00,1.0,57.0,3.2,131.6,79.0,8.6,57.8,0.6488,0.0,11,3.2,0.0,1007.6,6.1,10.0,57.86,70.6,68.59545454545454,39.5,70.6,2004-03-27 01:00:00
27/03/2004,02.00.00,1.2,65.0,4.5,141.0,78.0,8.1,62.1,0.6746,0.0,15,3.4,0.0,1007.7,5.9,12.0,65.7,91.83333333333333,73.82954545454545,39.0,91.83333333333333,2004-03-27 02:00:00
27/03/2004,03.00.00,1.1,59.0,3.8,0.0,0.0,7.9,63.5,0.6777,0.0,7,4.0,0.0,1007.9,5.6,11.0,59.82,80.39999999999999,0.0,0.0,80.39999999999999,2004-03-27 03:00:00
27/03/2004,04.00.00,0.0,48.0,3.8,107.16,63.0,7.4,64.8,0.6683,0.0,12,3.7,0.0,1008.0,5.4,0.0,48.0,80.39999999999999,54.98681818181818,31.5,80.39999999999999,2004-03-27 04:00:00
27/03/2004,05.00.00,0.8,27.0,1.9,60.16,48.0,8.2,58.9,0.6444,0.0,11,3.7,0.0,1008.7,5.1,8.0,27.0,47.5,30.08,24.0,47.5,2004-03-27 05:00:00
27/03/2004,06.00.00,0.9,25.0,2.4,101.52,59.0,6.3,66.6,0.641,0.0,8,5.2,111.6,1009.1,5.5,9.0,25.0,57.53333333333333,51.846363636363634,29.5,57.53333333333333,2004-03-27 06:00:00
27/03/2004,07.00.00,1.1,42.0,3.3,127.83999999999999,65.0,7.2,62.9,0.6396,0.0,11,3.8,371.0,1009.7,8.1,11.0,42.0,72.23333333333332,66.50181818181818,32.5,72.23333333333332,2004-03-27 07:00:00
27/03/2004,08.00.00,1.5,78.0,6.7,184.23999999999998,71.0,7.2,63.9,0.65,0.0,7,2.4,610.1,1010.4,10.4,15.0,78.44,117.66,97.90636363636362,35.5,117.66,2004-03-27 08:00:00
27/03/2004,09.00.00,1.8,128.0,8.5,240.64,84.0,11.1,50.5,0.6654,0.0,27,2.9,810.6,1010.7,12.2,18.0,114.72,135.3,106.27476482617587,42.0,135.3,2004-03-27 09:00:00
27/03/2004,10.00.00,2.1,184.0,9.7,242.51999999999998,93.0,15.5,36.1,0.6313,0.0,38,5.7,958.8,1011.5,13.0,21.0,142.16,147.06,106.46314928425357,46.5,147.06,2004-03-27 10:00:00
27/03/2004,11.00.00,2.1,156.0,9.4,244.39999999999998,99.0,17.8,29.2,0.592,0.1,45,7.1,1044.8,1011.2,13.6,21.0,128.44,144.12,106.65153374233128,49.5,144.12,2004-03-27 11:00:00
27/03/2004,12.00.00,1.9,176.0,9.0,208.67999999999998,93.0,17.6,30.1,0.6013,0.0,34,8.2,1062.5,1011.2,14.0,19.0,138.24,140.2,103.0722290388548,46.5,140.2,2004-03-27 12:00:00
27/03/2004,13.00.00,2.1,232.0,10.0,199.28,96.0,19.1,26.8,0.5861,0.0,36,9.9,1010.9,1011.3,14.2,21.0,158.84,150.0,102.13030674846625,48.0,158.84,2004-03-27 13:00:00
27/03/2004,14.00.00,2.5,305.0,12.6,257.56,114.0,17.7,28.6,0.5735,0.0,49,9.4,893.6,1011.3,14.6,25.0,176.725,159.49333333333334,107.97022494887526,58.79545454545455,176.725,2004-03-27 14:00:00
27/03/2004,15.00.00,1.9,150.0,7.6,212.44,101.0,17.8,28.4,0.5737,0.0,85,7.7,718.4,1011.4,14.3,19.0,125.5,126.47999999999999,103.44899795501023,51.55681818181818,126.47999999999999,2004-03-27 15:00:00
27/03/2004,16.00.00,2.2,188.0,11.8,229.35999999999999,108.0,18.7,26.0,0.5555,0.0,92,7.1,497.4,1011.8,13.3,22.0,144.12,156.88,105.14445807770961,55.45454545454545,156.88,2004-03-27 16:00:00
27/03/2004,17.00.00,2.3,221.0,11.2,257.56,117.0,17.1,31.3,0.6038,0.5,81,4.1,245.7,1012.2,12.1,23.0,156.145,154.92,107.97022494887526,60.46590909090909,156.145,2004-03-27 17:00:00
27/03/2004,18.00.00,2.7,219.0,12.4,310.2,125.0,15.8,36.1,0.644,0.0,90,5.8,47.0,1012.8,10.7,27.0,155.655,158.84,113.24498977505112,64.92045454545455,158.84,2004-03-27 18:00:00
27/03/2004,19.00.00,3.0,306.0,12.9,368.47999999999996,133.0,14.7,40.1,0.6657,0.0,92,6.4,0.0,1013.4,9.5,30.0,176.97,160.47333333333333,119.08490797546011,69.375,176.97,2004-03-27 19:00:00
27/03/2004,20.00.00,2.8,270.0,12.2,327.12,119.0,13.6,44.9,0.6991,0.0,98,6.1,0.0,1014.1,8.9,28.0,168.15,158.18666666666667,114.94044989775051,61.57954545454545,168.15,2004-03-27 20:00:00
27/03/2004,21.00.00,2.2,231.0,8.8,263.2,107.0,12.5,48.1,0.6946,0.0,99,5.9,0.0,1014.3,8.3,22.0,158.595,138.24,108.53537832310839,54.89772727272727,158.595,2004-03-27 21:00:00
27/03/2004,22.00.00,1.6,125.0,6.8,191.76,96.0,11.8,50.8,0.7042,0.0,98,4.3,0.0,1014.6,7.8,16.0,113.25,118.64,101.37676891615541,48.0,118.64,2004-03-27 22:00:00
27/03/2004,23.00.00,2.1,122.0,8.6,244.39999999999998,105.0,10.9,56.1,0.7326,0.0,94,4.6,0.0,1014.8,7.2,21.0,111.78,136.28,106.65153374233128,53.78409090909091,136.28,2004-03-27 23:00:00
28/03/2004,00.00.00,2.3,161.0,8.9,227.48,102.0,10.9,55.9,0.7277,0.0,15,3.5,0.0,1014.7,6.8,23.0,130.89,139.22,104.9560736196319,52.11363636363637,139.22,2004-03-28 00:00:00
28/03/2004,01.00.00,2.3,101.0,8.3,208.67999999999998,97.0,10.3,58.1,0.7278,0.0,22,4.0,0.0,1014.6,6.3,23.0,101.49,133.34,103.0722290388548,48.5,133.34,2004-03-28 01:00:00
28/03/2004,02.00.00,1.7,95.0,6.3,163.56,79.0,9.3,62.2,0.7294,0.0,56,4.5,0.0,1014.6,5.9,17.0,95.1,113.74,86.39136363636364,39.5,113.74,2004-03-28 02:00:00
28/03/2004,03.00.00,2.2,129.0,8.3,0.0,0.0,8.2,66.7,0.7276,0.0,78,4.7,0.0,1014.4,5.7,22.0,115.21,133.34,0.0,0.0,133.34,2004-03-28 03:00:00
28/03/2004,04.00.00,1.3,96.0,5.1,144.76,69.0,8.3,64.9,0.7124,0.0,41,5.0,0.0,1014.6,5.4,13.0,96.08,101.97999999999999,75.9231818181818,34.5,101.97999999999999,2004-03-28 04:00:00
28/03/2004,05.00.00,0.8,54.0,2.6,73.32,52.0,9.6,58.5,0.7,0.0,5,6.2,0.0,1014.6,5.2,8.0,54.92,60.8,36.66,26.0,60.8,2004-03-28 05:00:00
28/03/2004,06.00.00,1.1,63.0,3.6,144.76,62.0,7.7,66.4,0.699,0.0,72,7.7,117.3,1014.7,5.6,11.0,63.74,77.13333333333333,75.9231818181818,31.0,77.13333333333333,2004-03-28 06:00:00
28/03/2004,07.00.00,1.4,72.0,3.6,171.07999999999998,69.0,7.4,68.0,0.7043,0.0,63,5.6,378.3,1014.9,8.1,14.0,72.56,77.13333333333333,90.57863636363635,34.5,90.57863636363635,2004-03-28 07:00:00
28/03/2004,08.00.00,1.3,91.0,4.7,197.39999999999998,75.0,9.7,58.6,0.7035,0.0,33,4.5,617.0,1015.5,10.5,13.0,91.18,95.1,101.94192229038855,37.5,101.94192229038855,2004-03-28 08:00:00
28/03/2004,09.00.00,1.9,127.0,7.5,250.04,83.0,12.5,50.1,0.7242,0.0,91,4.0,817.1,1015.7,12.4,19.0,114.23,125.5,107.21668711656442,41.5,125.5,2004-03-28 09:00:00
28/03/2004,10.00.00,2.3,193.0,9.0,240.64,94.0,16.8,36.9,0.7018,0.0,100,4.5,964.9,1015.9,14.1,23.0,146.57,140.2,106.27476482617587,47.0,146.57,2004-03-28 10:00:00
28/03/2004,11.00.00,2.3,188.0,9.5,236.88,96.0,19.2,31.3,0.6887,0.0,99,2.9,1050.4,1015.5,15.2,23.0,144.12,145.1,105.89799591002046,48.0,145.1,2004-03-28 11:00:00
28/03/2004,12.00.00,1.8,151.0,7.7,172.95999999999998,86.0,21.3,26.4,0.6607,0.0,98,2.6,1067.7,1014.8,16.1,18.0,125.99,127.46000000000001,91.62545454545453,43.0,127.46000000000001,2004-03-28 12:00:00
28/03/2004,13.00.00,1.4,103.0,5.7,124.08,72.0,21.2,23.1,0.5768,0.0,98,3.3,1015.9,1014.2,16.6,14.0,102.47,107.86,64.40818181818182,36.0,107.86,2004-03-28 13:00:00
28/03/2004,14.00.00,1.0,55.0,3.8,94.0,53.0,18.6,25.0,0.5319,0.0,90,3.1,898.2,1013.8,16.7,10.0,55.9,80.39999999999999,47.0,26.5,80.39999999999999,2004-03-28 14:00:00
28/03/2004,15.00.00,1.4,104.0,4.8,131.6,65.0,18.0,27.3,0.5594,0.0,7,5.1,723.0,1013.7,16.2,14.0,102.96,96.73333333333332,68.59545454545454,32.5,102.96,2004-03-28 15:00:00
28/03/2004,16.00.00,1.3,116.0,4.3,137.23999999999998,70.0,18.2,28.3,0.5848,0.0,2,9.8,502.0,1013.9,15.1,13.0,108.84,88.56666666666666,71.73590909090908,35.0,108.84,2004-03-28 16:00:00
28/03/2004,17.00.00,1.3,93.0,4.1,144.76,75.0,17.0,31.4,0.6048,0.0,99,8.6,250.4,1014.0,13.7,13.0,93.14,85.29999999999998,75.9231818181818,37.5,93.14,2004-03-28 17:00:00
28/03/2004,18.00.00,1.4,93.0,4.7,161.67999999999998,86.0,15.6,35.0,0.617,0.0,94,5.7,49.4,1014.5,12.2,14.0,93.14,95.1,85.34454545454544,43.0,95.1,2004-03-28 18:00:00
28/03/2004,19.00.00,1.9,155.0,6.2,174.84,94.0,14.1,40.2,0.6438,0.0,98,6.2,0.0,1015.0,11.1,19.0,127.95,112.76,92.67227272727273,47.0,127.95,2004-03-28 19:00:00
28/03/2004,20.00.00,1.8,115.0,5.5,197.39999999999998,103.0,13.4,43.2,0.6623,0.0,5,2.2,0.0,1015.8,9.8,18.0,108.35,105.9,101.94192229038855,52.67045454545455,108.35,2004-03-28 20:00:00
28/03/2004,21.00.00,1.1,75.0,3.3,125.96,81.0,12.3,46.8,0.6686,0.0,9,2.0,0.0,1016.0,8.8,11.0,75.5,72.23333333333332,65.455,40.5,75.5,2004-03-28 21:00:00
28/03/2004,22.00.00,1.1,65.0,3.2,118.44,80.0,11.9,46.5,0.6449,0.0,5,3.4,0.0,1016.6,8.2,11.0,65.7,70.6,61.26772727272727,40.0,70.6,2004-03-28 22:00:00
28/03/2004,23.00.00,1.1,57.0,2.9,118.44,77.0,11.5,46.6,0.6319,0.0,3,5.1,0.0,1017.0,7.7,11.0,57.86,65.7,61.26772727272727,38.5,65.7,2004-03-28 23:00:00
29/03/2004,00.00.00,0.9,40.0,2.2,86.47999999999999,58.0,10.6,48.0,0.6135,0.0,1,4.6,0.0,1016.7,7.3,9.0,40.0,54.266666666666666,43.239999999999995,29.0,54.266666666666666,2004-03-29 00:00:00
29/03/2004,01.00.00,0.6,27.0,1.3,39.48,31.0,10.7,45.8,0.5895,0.0,2,5.4,0.0,1017.0,7.1,6.0,27.0,32.5,19.74,15.5,32.5,2004-03-29 01:00:00
29/03/2004,02.00.00,0.5,23.0,1.1,41.36,38.0,10.4,46.6,0.5901,0.0,2,6.4,0.0,1016.7,6.9,5.0,23.0,27.500000000000004,20.68,19.0,27.500000000000004,2004-03-29 02:00:00
29/03/2004,03.00.00,0.7,28.0,1.3,0.0,0.0,10.1,47.8,0.5913,0.0,5,7.4,0.0,1016.3,6.8,7.0,28.0,32.5,0.0,0.0,32.5,2004-03-29 03:00:00
29/03/2004,04.00.00,0.6,21.0,1.2,73.32,59.0,11.3,46.9,0.628,0.0,14,8.1,0.0,1016.1,6.6,6.0,21.0,30.0,36.66,29.5,36.66,2004-03-29 04:00:00
29/03/2004,05.00.00,0.7,33.0,1.7,103.39999999999999,70.0,10.1,51.2,0.6341,0.0,12,8.4,0.0,1016.3,6.5,7.0,33.0,42.5,52.893181818181816,35.0,52.893181818181816,2004-03-29 05:00:00
29/03/2004,06.00.00,0.9,40.0,2.9,142.88,75.0,9.9,50.7,0.6167,0.0,12,9.4,124.8,1016.5,7.0,9.0,40.0,65.7,74.87636363636364,37.5,74.87636363636364,2004-03-29 06:00:00
29/03/2004,07.00.00,2.9,279.0,14.3,340.28,103.0,8.1,56.8,0.615,0.0,7,6.1,385.6,1016.7,9.1,29.0,170.355,165.04666666666668,116.25914110429447,52.67045454545455,170.355,2004-03-29 07:00:00
29/03/2004,08.00.00,4.1,743.0,19.7,486.91999999999996,134.0,10.9,44.1,0.5748,0.0,4,4.7,623.9,1017.2,11.3,41.0,285.8925,182.68666666666667,130.95312883435582,69.93181818181819,285.8925,2004-03-29 08:00:00
29/03/2004,09.00.00,1.5,147.0,5.5,221.83999999999997,98.0,11.8,37.6,0.5184,0.0,3,3.9,823.5,1017.0,13.5,15.0,124.03,105.9,104.39092024539877,49.0,124.03,2004-03-29 09:00:00
29/03/2004,10.00.00,1.5,97.0,5.6,223.72,97.0,13.9,33.2,0.5222,0.0,6,3.3,970.8,1016.8,15.4,15.0,97.06,106.88,104.57930470347648,48.5,106.88,2004-03-29 10:00:00
29/03/2004,11.00.00,1.5,118.0,5.8,231.23999999999998,98.0,15.6,30.1,0.5285,0.0,33,3.0,1055.9,1016.5,16.6,15.0,109.82,108.84,105.33284253578732,49.0,109.82,2004-03-29 11:00:00
29/03/2004,12.00.00,1.4,91.0,5.5,172.95999999999998,78.0,16.5,29.0,0.5406,0.0,40,1.1,1072.9,1015.8,17.5,14.0,91.18,105.9,91.62545454545453,39.0,105.9,2004-03-29 12:00:00
29/03/2004,13.00.00,1.6,146.0,6.5,171.07999999999998,83.0,17.5,27.9,0.5517,0.0,51,2.4,1020.7,1015.3,18.0,16.0,123.53999999999999,115.7,90.57863636363635,41.5,123.53999999999999,2004-03-29 13:00:00
29/03/2004,14.00.00,1.5,139.0,5.5,193.64,92.0,17.9,26.8,0.5446,0.0,86,4.5,902.9,1014.3,17.9,15.0,120.11,105.9,101.56515337423313,46.0,120.11,2004-03-29 14:00:00
29/03/2004,15.00.00,1.4,155.0,5.2,191.76,81.0,18.2,26.1,0.5387,0.0,65,5.9,727.5,1013.6,17.4,14.0,127.95,102.96000000000001,101.37676891615541,40.5,127.95,2004-03-29 15:00:00
29/03/2004,16.00.00,1.5,128.0,5.8,176.72,90.0,18.0,27.1,0.5522,0.0,30,7.8,506.5,1013.7,16.5,15.0,114.72,108.84,93.71909090909091,45.0,114.72,2004-03-29 16:00:00
29/03/2004,17.00.00,1.9,166.0,7.9,184.23999999999998,95.0,17.0,28.9,0.5558,0.0,13,7.9,255.1,1013.9,15.0,19.0,133.34,129.42000000000002,97.90636363636362,47.5,133.34,2004-03-29 17:00:00
29/03/2004,18.00.00,2.5,299.0,10.2,236.88,114.0,16.1,31.3,0.568,0.0,13,5.6,51.8,1014.3,13.6,25.0,175.255,151.65333333333334,105.89799591002046,58.79545454545455,175.255,2004-03-29 18:00:00
29/03/2004,19.00.00,2.1,163.0,8.2,203.04,106.0,14.5,35.4,0.5839,0.0,16,3.2,0.0,1014.6,12.2,21.0,131.87,132.35999999999999,102.50707566462168,54.34090909090909,132.35999999999999,2004-03-29 19:00:00
29/03/2004,20.00.00,1.6,154.0,5.7,178.6,99.0,13.2,37.9,0.5733,0.0,9,5.5,0.0,1014.7,10.9,16.0,127.46000000000001,107.86,94.76590909090908,49.5,127.46000000000001,2004-03-29 20:00:00
29/03/2004,21.00.00,1.2,80.0,3.8,146.64,90.0,13.1,34.4,0.517,0.0,30,5.8,0.0,1014.8,10.2,12.0,80.4,80.39999999999999,76.97,45.0,80.4,2004-03-29 21:00:00
29/03/2004,22.00.00,1.1,58.0,4.0,114.67999999999999,82.0,13.5,28.5,0.4405,0.0,51,5.5,0.0,1014.5,9.8,11.0,58.84,83.66666666666666,59.17409090909091,41.0,83.66666666666666,2004-03-29 22:00:00
29/03/2004,23.00.00,1.0,55.0,2.8,103.39999999999999,74.0,12.4,31.9,0.4583,0.0,59,4.8,0.0,1014.9,9.6,10.0,55.9,64.06666666666666,52.893181818181816,37.0,64.06666666666666,2004-03-29 23:00:00
30/03/2004,00.00.00,1.0,33.0,2.6,107.16,76.0,13.1,26.8,0.4023,0.0,51,5.4,0.0,1015.1,9.5,10.0,33.0,60.8,54.98681818181818,38.0,60.8,2004-03-30 00:00:00
30/03/2004,01.00.00,0.7,33.0,1.8,77.08,66.0,11.6,33.6,0.4595,0.0,68,5.7,0.0,1014.7,9.3,7.0,33.0,45.0,38.54,33.0,45.0,2004-03-30 01:00:00
30/03/2004,02.00.00,0.7,32.0,1.7,86.47999999999999,73.0,10.5,42.9,0.5442,0.0,35,4.4,0.0,1014.3,8.9,7.0,32.0,42.5,43.239999999999995,36.5,43.239999999999995,2004-03-30 02:00:00
30/03/2004,03.00.00,0.8,25.0,1.4,0.0,0.0,11.7,38.7,0.5298,0.0,57,4.4,0.0,1014.3,8.9,8.0,25.0,35.0,0.0,0.0,35.0,2004-03-30 03:00:00
30/03/2004,04.00.00,0.0,29.0,1.3,77.08,69.0,12.2,37.2,0.5277,0.0,64,4.9,0.0,1014.5,8.6,0.0,29.0,32.5,38.54,34.5,38.54,2004-03-30 04:00:00
30/03/2004,05.00.00,0.7,26.0,2.3,97.75999999999999,71.0,12.9,33.9,0.5037,0.2,79,5.5,0.0,1014.5,8.7,7.0,26.0,55.9,48.879999999999995,35.5,55.9,2004-03-30 05:00:00
30/03/2004,06.00.00,1.1,86.0,5.3,208.67999999999998,98.0,11.3,40.3,0.5376,0.1,85,6.1,132.3,1014.9,9.1,11.0,86.28,103.94,103.0722290388548,49.0,103.94,2004-03-30 06:00:00
30/03/2004,07.00.00,2.6,294.0,13.4,359.08,115.0,11.9,38.4,0.5341,0.0,75,3.8,392.7,1015.1,10.5,26.0,174.03,162.10666666666665,118.14298568507158,59.35227272727273,174.03,2004-03-30 07:00:00
30/03/2004,08.00.00,4.0,664.0,23.8,458.71999999999997,130.0,13.3,35.6,0.5416,0.2,90,2.9,630.6,1015.7,11.5,40.0,266.34000000000003,196.07999999999998,128.12736196319017,67.70454545454545,266.34000000000003,2004-03-30 08:00:00
30/03/2004,09.00.00,4.2,695.0,21.5,532.04,150.0,16.3,28.8,0.5305,0.5,100,2.7,829.8,1016.1,12.5,42.0,274.0125,188.56666666666666,135.47435582822084,78.8409090909091,274.0125,2004-03-30 09:00:00
30/03/2004,10.00.00,4.7,735.0,21.0,601.5999999999999,159.0,17.9,28.2,0.5741,1.3,90,2.0,976.7,1016.2,13.1,47.0,283.9125,186.93333333333334,142.44458077709612,83.85227272727272,283.9125,2004-03-30 10:00:00
30/03/2004,11.00.00,3.9,649.0,18.4,468.11999999999995,146.0,18.3,26.6,0.5529,1.5,86,1.5,1061.3,1016.3,12.9,39.0,262.6275,178.44,129.06928425357873,76.61363636363636,262.6275,2004-03-30 11:00:00
30/03/2004,12.00.00,3.7,586.0,18.9,411.71999999999997,138.0,20.8,22.5,0.5463,0.3,93,3.6,1078.0,1016.2,13.1,37.0,247.035,180.07333333333332,123.41775051124745,72.1590909090909,247.035,2004-03-30 12:00:00
30/03/2004,13.00.00,3.4,546.0,17.1,376.0,128.0,22.4,20.0,0.5352,0.3,100,5.0,1025.5,1016.0,13.0,34.0,237.135,174.19333333333333,119.83844580777097,66.5909090909091,237.135,2004-03-30 13:00:00
30/03/2004,14.00.00,2.2,245.0,10.4,259.44,97.0,20.9,21.7,0.5295,0.1,100,5.5,907.4,1015.6,12.7,22.0,162.025,152.30666666666667,108.15860940695296,48.5,162.025,2004-03-30 14:00:00
30/03/2004,15.00.00,1.9,178.0,8.0,221.83999999999997,91.0,19.1,26.5,0.579,0.1,100,5.7,732.0,1015.6,12.6,19.0,139.22,130.4,104.39092024539877,45.5,139.22,2004-03-30 15:00:00
30/03/2004,16.00.00,1.6,130.0,6.2,186.11999999999998,81.0,18.1,30.6,0.6295,0.0,100,5.4,511.0,1015.6,12.4,16.0,115.7,112.76,98.9531818181818,40.5,115.7,2004-03-30 16:00:00
30/03/2004,17.00.00,2.1,151.0,9.7,210.56,99.0,17.3,34.7,0.6788,0.0,98,3.3,259.7,1015.6,12.1,21.0,125.99,147.06,103.26061349693252,49.5,147.06,2004-03-30 17:00:00
30/03/2004,18.00.00,2.2,272.0,9.6,219.95999999999998,101.0,15.8,40.4,0.7228,0.0,91,2.5,54.1,1015.8,11.8,22.0,168.64,146.07999999999998,104.20253578732107,51.55681818181818,168.64,2004-03-30 18:00:00
30/03/2004,19.00.00,2.7,301.0,11.9,242.51999999999998,106.0,15.9,42.0,0.7541,0.0,77,3.3,0.0,1016.2,11.5,27.0,175.745,157.20666666666668,106.46314928425357,54.34090909090909,175.745,2004-03-30 19:00:00
30/03/2004,20.00.00,2.4,237.0,8.7,248.16,102.0,15.9,43.5,0.779,0.0,74,3.3,0.0,1016.5,11.0,24.0,160.065,137.26,107.02830265848671,52.11363636363637,160.065,2004-03-30 20:00:00
30/03/2004,21.00.00,1.3,95.0,4.7,137.23999999999998,84.0,15.0,46.1,0.7833,0.0,70,3.2,0.0,1016.9,10.7,13.0,95.1,95.1,71.73590909090908,42.0,95.1,2004-03-30 21:00:00
30/03/2004,22.00.00,1.2,68.0,3.8,127.83999999999999,81.0,15.1,44.6,0.7574,0.0,78,4.2,0.0,1016.8,10.4,12.0,68.64,80.39999999999999,66.50181818181818,40.5,80.39999999999999,2004-03-30 22:00:00
30/03/2004,23.00.00,1.5,101.0,4.7,150.39999999999998,91.0,14.9,43.5,0.7302,0.1,80,3.3,0.0,1016.8,10.5,15.0,101.49,95.1,79.06363636363635,45.5,101.49,2004-03-30 23:00:00
31/03/2004,00.00.00,1.3,81.0,3.8,127.83999999999999,82.0,14.8,41.0,0.685,0.0,77,4.9,0.0,1016.6,10.4,13.0,81.38,80.39999999999999,66.50181818181818,41.0,81.38,2004-03-31 00:00:00
31/03/2004,01.00.00,1.0,50.0,2.7,82.72,64.0,14.8,40.8,0.6814,0.1,73,5.4,0.0,1016.3,9.9,10.0,50.0,62.43333333333334,41.36,32.0,62.43333333333334,2004-03-31 01:00:00
31/03/2004,02.00.00,0.9,66.0,2.8,88.36,70.0,14.8,40.8,0.6834,0.0,51,5.1,0.0,1015.9,9.6,9.0,66.68,64.06666666666666,44.18,35.0,66.68,2004-03-31 02:00:00
31/03/2004,03.00.00,0.5,22.0,1.0,0.0,0.0,14.2,36.1,0.5823,0.0,50,4.9,0.0,1015.2,9.5,5.0,22.0,25.0,0.0,0.0,25.0,2004-03-31 03:00:00
31/03/2004,04.00.00,0.5,18.0,0.8,28.2,26.0,14.5,36.1,0.5928,0.2,59,4.6,0.0,1014.8,9.4,5.0,18.0,20.0,14.1,13.0,20.0,2004-03-31 04:00:00
31/03/2004,05.00.00,0.6,31.0,1.5,82.72,58.0,14.6,36.0,0.5947,0.4,98,4.4,0.0,1015.0,9.6,6.0,31.0,37.5,41.36,29.0,41.36,2004-03-31 05:00:00
31/03/2004,06.00.00,1.0,57.0,3.5,159.79999999999998,93.0,14.4,38.5,0.6291,0.1,95,5.6,139.8,1014.9,10.0,10.0,57.86,75.5,84.29772727272726,46.5,84.29772727272726,2004-03-31 06:00:00
31/03/2004,07.00.00,3.1,342.0,15.6,389.15999999999997,110.0,13.8,58.2,0.9129,0.0,83,2.9,399.9,1014.9,10.9,31.0,185.79,169.29333333333332,121.15713701431493,56.56818181818182,185.79,2004-03-31 07:00:00
31/03/2004,08.00.00,4.1,644.0,19.9,432.4,115.0,13.2,61.1,0.9256,0.0,99,0.4,637.3,1015.1,13.1,41.0,261.39,183.34,125.48997955010225,59.35227272727273,261.39,2004-03-31 08:00:00
31/03/2004,09.00.00,2.2,216.0,8.6,340.28,125.0,10.4,74.4,0.9384,0.3,66,1.9,836.1,1015.2,13.6,22.0,154.92,136.28,116.25914110429447,64.92045454545455,154.92,2004-03-31 09:00:00
31/03/2004,10.00.00,1.7,117.0,6.5,270.71999999999997,118.0,11.5,71.0,0.9582,1.1,71,3.5,982.5,1014.7,14.1,17.0,109.33,115.7,109.28891615541922,61.02272727272727,115.7,2004-03-31 10:00:00
31/03/2004,11.00.00,1.9,156.0,7.7,263.2,109.0,12.2,70.0,0.9924,0.4,92,1.8,1066.7,1014.5,15.2,19.0,128.44,127.46000000000001,108.53537832310839,56.01136363636363,128.44,2004-03-31 11:00:00
31/03/2004,12.00.00,2.9,332.0,11.3,383.52,123.0,12.3,73.3,1.0442,0.6,96,7.9,1082.9,1014.4,15.1,29.0,183.34,155.24666666666667,120.59198364008179,63.80681818181818,183.34,2004-03-31 12:00:00
31/03/2004,13.00.00,2.2,232.0,9.1,280.12,114.0,11.3,78.1,1.0411,0.5,99,9.0,1030.2,1013.9,15.4,22.0,158.84,141.18,110.23083844580778,58.79545454545455,158.84,2004-03-31 13:00:00
31/03/2004,14.00.00,2.6,295.0,11.2,321.47999999999996,114.0,13.6,69.2,1.0746,0.3,100,8.1,911.9,1013.7,14.9,26.0,174.275,154.92,114.37529652351738,58.79545454545455,174.275,2004-03-31 14:00:00
31/03/2004,15.00.00,3.1,386.0,13.5,366.59999999999997,119.0,14.9,59.3,0.9974,0.5,100,6.6,736.4,1013.3,14.4,31.0,196.57,162.43333333333334,118.8965235173824,61.57954545454545,196.57,2004-03-31 15:00:00
31/03/2004,16.00.00,2.3,278.0,10.1,285.76,111.0,15.7,50.9,0.8997,0.5,100,5.4,515.5,1013.1,13.9,23.0,170.11,151.32666666666665,110.7959918200409,57.125,170.11,2004-03-31 16:00:00
31/03/2004,17.00.00,2.4,263.0,11.3,240.64,103.0,15.2,52.9,0.9087,0.6,100,6.2,264.4,1012.6,13.4,24.0,166.435,155.24666666666667,106.27476482617587,52.67045454545455,166.435,2004-03-31 17:00:00
31/03/2004,18.00.00,2.8,322.0,11.8,227.48,103.0,15.5,50.8,0.8881,0.6,100,6.8,56.5,1012.0,13.0,28.0,180.89,156.88,104.9560736196319,52.67045454545455,180.89,2004-03-31 18:00:00
31/03/2004,19.00.00,2.7,226.0,11.5,266.96,107.0,14.3,52.9,0.8581,1.0,97,3.7,0.0,1012.1,12.5,27.0,157.37,155.9,108.9121472392638,54.89772727272727,157.37,2004-03-31 19:00:00
31/03/2004,20.00.00,2.3,221.0,9.3,246.27999999999997,105.0,13.2,56.0,0.8446,0.7,100,4.7,0.0,1012.1,12.2,23.0,156.145,143.14000000000001,106.83991820040899,53.78409090909091,156.145,2004-03-31 20:00:00
31/03/2004,21.00.00,1.5,109.0,5.5,152.28,91.0,12.6,57.0,0.8315,0.7,100,4.0,0.0,1012.3,12.1,15.0,105.41,105.9,80.11045454545454,45.5,105.9,2004-03-31 21:00:00
31/03/2004,22.00.00,1.4,105.0,5.1,112.8,79.0,12.3,57.8,0.8224,0.6,100,5.1,0.0,1011.7,11.9,14.0,103.45,101.97999999999999,58.127272727272725,39.5,103.45,2004-03-31 22:00:00
31/03/2004,23.00.00,1.2,84.0,4.8,107.16,79.0,12.0,58.4,0.8164,1.3,100,4.0,0.0,1012.1,11.9,12.0,84.32,96.73333333333332,54.98681818181818,39.5,96.73333333333332,2004-03-31 23:00:00
01/04/2004,00.00.00,1.6,106.0,6.3,180.48,86.0,12.0,61.6,0.8593,1.4,100,3.3,0.0,1011.8,11.8,16.0,103.94,113.74,95.81272727272727,43.0,113.74,2004-04-01 00:00:00
01/04/2004,01.00.00,1.2,100.0,5.1,159.79999999999998,70.0,11.5,63.9,0.8652,1.2,100,3.4,0.0,1011.6,11.8,12.0,100.0,101.97999999999999,84.29772727272726,35.0,101.97999999999999,2004-04-01 01:00:00
01/04/2004,02.00.00,1.1,71.0,4.1,94.0,55.0,10.7,67.2,0.863,0.5,100,4.3,0.0,1010.9,11.7,11.0,71.58,85.29999999999998,47.0,27.5,85.29999999999998,2004-04-01 02:00:00
01/04/2004,03.00.00,0.9,72.0,4.0,0.0,0.0,9.0,73.1,0.8394,0.4,100,4.0,0.0,1010.7,11.6,9.0,72.56,83.66666666666666,0.0,0.0,83.66666666666666,2004-04-01 03:00:00
01/04/2004,04.00.00,0.7,44.0,2.4,107.16,49.0,10.2,66.6,0.8299,0.2,98,4.8,0.0,1010.4,11.6,7.0,44.0,57.53333333333333,54.98681818181818,24.5,57.53333333333333,2004-04-01 04:00:00
01/04/2004,05.00.00,0.9,45.0,2.9,120.32,50.0,11.0,63.7,0.8325,0.0,78,5.3,0.0,1010.2,11.5,9.0,45.0,65.7,62.31454545454545,25.0,65.7,2004-04-01 05:00:00
01/04/2004,06.00.00,1.7,134.0,7.4,287.64,67.0,9.6,68.8,0.8243,0.1,65,6.2,147.2,1010.4,11.6,17.0,117.66,124.52000000000001,110.9843762781186,33.5,124.52000000000001,2004-04-01 06:00:00
01/04/2004,07.00.00,4.2,505.0,19.8,642.9599999999999,94.0,9.5,69.6,0.8273,0.1,68,4.0,406.9,1010.5,12.5,42.0,226.9875,183.01333333333332,146.58903885480572,47.0,226.9875,2004-04-01 07:00:00
01/04/2004,08.00.00,6.2,1042.0,31.9,710.64,119.0,11.9,60.9,0.8455,0.0,85,3.8,643.9,1011.1,13.5,62.760000000000005,330.9475,269.31,154.03007352941177,61.57954545454545,330.9475,2004-04-01 08:00:00
01/04/2004,09.00.00,4.6,737.0,21.0,571.52,139.0,16.2,48.6,0.8892,0.0,93,3.8,842.2,1011.2,14.4,46.0,284.4075,186.93333333333334,139.43042944785276,72.7159090909091,284.4075,2004-04-01 09:00:00
01/04/2004,10.00.00,2.8,375.0,11.7,360.96,113.0,19.2,39.6,0.8693,0.0,74,5.1,988.2,1011.1,15.3,28.0,193.875,156.55333333333334,118.33137014314929,58.23863636363636,193.875,2004-04-01 10:00:00
01/04/2004,11.00.00,1.6,124.0,6.8,244.39999999999998,88.0,19.7,38.4,0.8743,0.9,78,6.3,1072.0,1011.2,15.6,16.0,112.76,118.64,106.65153374233128,44.0,118.64,2004-04-01 11:00:00
01/04/2004,12.00.00,1.7,137.0,7.4,199.28,73.0,20.6,36.7,0.8797,0.1,61,8.6,1087.8,1010.7,15.9,17.0,119.13,124.52000000000001,102.13030674846625,36.5,124.52000000000001,2004-04-01 12:00:00
01/04/2004,13.00.00,1.7,179.0,8.6,191.76,73.0,21.8,33.9,0.8771,0.1,44,8.5,1034.8,1010.6,16.2,17.0,139.71,136.28,101.37676891615541,36.5,139.71,2004-04-01 13:00:00
01/04/2004,14.00.00,1.7,222.0,0.0,186.11999999999998,72.0,-200.0,-200.0,-200.0,0.2,40,5.9,916.4,1010.6,17.1,17.0,156.39,0.0,98.9531818181818,36.0,156.39,2004-04-01 14:00:00
01/04/2004,15.00.00,1.9,197.0,0.0,203.04,81.0,-200.0,-200.0,-200.0,0.5,47,5.4,740.8,1010.7,16.9,19.0,148.53,0.0,102.50707566462168,40.5,148.53,2004-04-01 15:00:00
01/04/2004,16.00.00,2.3,319.0,0.0,246.27999999999997,93.0,-200.0,-200.0,-200.0,2.4,50,6.2,519.9,1010.6,16.2,23.0,180.155,0.0,106.83991820040899,46.5,180.155,2004-04-01 16:00:00
01/04/2004,17.00.00,3.3,388.0,16.4,306.44,106.0,23.6,27.5,0.7913,1.4,58,4.8,268.9,1011.2,15.1,33.0,197.06,171.90666666666667,112.86822085889571,54.34090909090909,197.06,2004-04-01 17:00:00
01/04/2004,18.00.00,4.2,589.0,21.2,396.67999999999995,132.0,22.8,32.1,0.8814,0.1,62,2.8,58.9,1011.8,14.1,42.0,247.7775,187.58666666666667,121.91067484662577,68.81818181818181,247.7775,2004-04-01 18:00:00
01/04/2004,19.00.00,5.5,840.0,25.0,501.96,164.0,20.8,36.7,0.8878,0.0,38,5.4,0.0,1012.4,13.3,55.9,305.95,200.0,132.4602044989775,86.63636363636363,305.95,2004-04-01 19:00:00
01/04/2004,20.00.00,4.9,655.0,20.2,505.71999999999997,161.0,18.3,40.9,0.8493,0.0,26,4.8,0.0,1013.1,12.5,49.0,264.1125,184.32,132.83697341513292,84.9659090909091,264.1125,2004-04-01 20:00:00
01/04/2004,21.00.00,2.5,254.0,10.8,289.52,124.0,16.8,44.0,0.8341,0.0,27,2.3,0.0,1013.4,11.8,25.0,164.23,153.61333333333334,111.17276073619632,64.36363636363636,164.23,2004-04-01 21:00:00
01/04/2004,22.00.00,2.0,188.0,9.9,238.76,113.0,15.8,48.0,0.8569,0.0,26,0.7,0.0,1013.5,11.1,20.0,144.12,149.02,106.08638036809816,58.23863636363636,149.02,2004-04-01 22:00:00
01/04/2004,23.00.00,2.0,120.0,8.5,229.35999999999999,103.0,14.9,52.0,0.8757,0.0,20,4.0,0.0,1013.9,10.5,20.0,110.8,135.3,105.14445807770961,52.67045454545455,135.3,2004-04-01 23:00:00
02/04/2004,00.00.00,2.0,157.0,8.0,236.88,104.0,14.1,54.4,0.8701,0.0,21,5.0,0.0,1014.1,10.2,20.0,128.93,130.4,105.89799591002046,53.22727272727273,130.4,2004-04-02 00:00:00
02/04/2004,01.00.00,1.3,88.0,5.6,157.92,93.0,13.3,58.8,0.8922,0.0,26,3.9,0.0,1014.3,9.8,13.0,88.24000000000001,106.88,83.25090909090909,46.5,106.88,2004-04-02 01:00:00
02/04/2004,02.00.00,1.0,68.0,3.2,109.03999999999999,60.0,13.3,60.9,0.9229,0.0,15,3.8,0.0,1014.6,9.6,10.0,68.64,70.6,56.03363636363636,30.0,70.6,2004-04-02 02:00:00
02/04/2004,03.00.00,0.9,57.0,3.3,0.0,0.0,11.8,64.3,0.8869,0.0,69,5.4,0.0,1014.6,9.4,9.0,57.86,72.23333333333332,0.0,0.0,72.23333333333332,2004-04-02 03:00:00
02/04/2004,04.00.00,0.0,36.0,2.8,69.56,52.0,11.2,65.9,0.8775,0.0,80,5.8,0.0,1014.8,9.1,0.0,36.0,64.06666666666666,34.78,26.0,64.06666666666666,2004-04-02 04:00:00
02/04/2004,05.00.00,0.7,51.0,2.6,105.28,66.0,11.3,72.9,0.9738,0.0,86,6.1,0.8,1015.2,8.9,7.0,51.98,60.8,53.94,33.0,60.8,2004-04-02 05:00:00
02/04/2004,06.00.00,1.1,93.0,4.3,171.07999999999998,82.0,11.4,71.8,0.9671,0.0,86,6.0,154.5,1015.9,9.5,11.0,93.14,88.56666666666666,90.57863636363635,41.0,93.14,2004-04-02 06:00:00
02/04/2004,07.00.00,2.6,284.0,13.0,298.91999999999996,109.0,11.9,73.7,1.0254,0.0,20,4.2,413.9,1016.5,12.2,26.0,171.57999999999998,160.8,112.11468302658486,56.01136363636363,171.57999999999998,2004-04-02 07:00:00
02/04/2004,08.00.00,3.9,486.0,20.3,357.2,114.0,12.6,70.2,1.0221,0.0,19,2.9,650.5,1017.1,13.5,39.0,222.285,184.64666666666668,117.95460122699386,58.79545454545455,222.285,2004-04-02 08:00:00
02/04/2004,09.00.00,5.0,798.0,20.7,468.11999999999995,139.0,13.6,65.3,1.0136,0.0,71,5.1,848.3,1017.5,15.0,50.0,299.505,185.95333333333332,129.06928425357873,72.7159090909091,299.505,2004-04-02 09:00:00
02/04/2004,10.00.00,3.3,524.0,15.9,368.47999999999996,127.0,16.9,52.3,1.0013,0.1,83,5.8,993.8,1017.4,16.2,33.0,231.69,170.27333333333334,119.08490797546011,66.0340909090909,231.69,2004-04-02 10:00:00
02/04/2004,11.00.00,2.9,468.0,14.2,338.4,127.0,19.4,44.1,0.9855,0.0,89,7.3,1077.1,1017.4,16.8,29.0,217.82999999999998,164.72,116.07075664621676,66.0340909090909,217.82999999999998,2004-04-02 11:00:00
02/04/2004,12.00.00,3.1,454.0,15.9,313.96,135.0,22.9,33.8,0.9322,0.0,69,10.2,1092.7,1017.6,17.4,31.0,214.365,170.27333333333334,113.62175869120654,70.48863636363636,214.365,2004-04-02 12:00:00
02/04/2004,13.00.00,3.0,461.0,16.1,298.91999999999996,130.0,23.6,31.3,0.9001,0.0,55,10.6,1039.3,1017.5,17.9,30.0,216.0975,170.92666666666668,112.11468302658486,67.70454545454545,216.0975,2004-04-02 13:00:00
02/04/2004,14.00.00,2.7,391.0,14.7,285.76,126.0,24.7,30.5,0.9371,0.0,49,10.5,920.7,1017.4,17.6,27.0,197.79500000000002,166.35333333333332,110.7959918200409,65.47727272727272,197.79500000000002,2004-04-02 14:00:00
02/04/2004,15.00.00,2.7,337.0,14.0,280.12,121.0,26.1,27.3,0.9101,0.1,43,9.9,745.1,1017.4,17.4,27.0,184.565,164.06666666666666,110.23083844580778,62.69318181818181,184.565,2004-04-02 15:00:00
02/04/2004,16.00.00,2.6,297.0,13.6,268.84,122.0,27.6,22.8,0.8288,0.0,33,8.7,524.3,1017.8,16.7,26.0,174.765,162.76,109.10053169734151,63.25,174.765,2004-04-02 16:00:00
02/04/2004,17.00.00,3.7,588.0,19.7,347.79999999999995,138.0,26.9,22.3,0.7792,0.0,39,6.1,273.5,1018.1,15.7,37.0,247.53,182.68666666666667,117.01267893660531,72.1590909090909,247.53,2004-04-02 17:00:00
02/04/2004,18.00.00,4.5,721.0,23.3,419.23999999999995,165.0,24.3,30.1,0.9012,0.0,41,6.0,61.2,1018.6,14.5,45.0,280.4475,194.44666666666666,124.17128834355827,87.19318181818181,280.4475,2004-04-02 18:00:00
02/04/2004,19.00.00,4.7,710.0,24.1,404.2,154.0,21.2,40.1,0.9978,0.0,64,5.8,0.0,1019.4,13.6,47.0,277.725,197.06,122.66421267893661,81.06818181818181,277.725,2004-04-02 19:00:00
02/04/2004,20.00.00,5.5,787.0,25.4,509.47999999999996,168.0,19.4,42.5,0.9483,0.0,54,5.0,0.0,1020.1,12.7,55.9,296.7825,204.95999999999998,133.21374233128833,88.86363636363636,296.7825,2004-04-02 20:00:00
02/04/2004,21.00.00,3.0,415.0,14.1,338.4,146.0,18.5,43.0,0.9074,0.0,64,4.2,0.0,1020.6,11.9,30.0,204.7125,164.39333333333335,116.07075664621676,76.61363636363636,204.7125,2004-04-02 21:00:00
02/04/2004,22.00.00,1.9,245.0,10.1,216.2,124.0,17.8,47.0,0.9467,0.0,62,3.3,0.0,1020.4,11.3,19.0,162.025,151.32666666666665,103.82576687116564,64.36363636363636,162.025,2004-04-02 22:00:00
02/04/2004,23.00.00,2.3,294.0,12.1,280.12,124.0,16.8,53.2,1.01,0.0,88,4.0,0.0,1020.8,11.0,23.0,174.03,157.85999999999999,110.23083844580778,64.36363636363636,174.03,2004-04-02 23:00:00
03/04/2004,00.00.00,1.6,139.0,9.0,184.23999999999998,106.0,17.1,51.8,0.999,0.0,99,4.7,0.0,1021.2,10.9,16.0,120.11,140.2,97.90636363636362,54.34090909090909,140.2,2004-04-03 00:00:00
03/04/2004,01.00.00,1.3,98.0,6.3,137.23999999999998,88.0,16.2,54.2,0.9933,0.0,99,5.2,0.0,1021.0,10.6,13.0,98.03999999999999,113.74,71.73590909090908,44.0,113.74,2004-04-03 01:00:00
